company,valuation,industry,city,country,continent,year_founded,funding,select_investors,year_joined
6Sense,5000000000,Artificial intelligence,San Francisco,United States,North America,2013,426000000,"Venrock, Battery Ventures, Insight Partners",2021
Noom,4000000000,Health,New York,United States,North America,2006,657000000,"Qualcomm Ventures, Samsung Ventures, Silver Lake",2021
Yixia,3000000000,Mobile & telecommunications,Beijing,China,Asia,2011,775000000,"Sequoia Capital China, Sina Weibo, Kleiner Perkins Caufield & Byers, Redpoint Ventures",2015
Transmit Security,3000000000,Cybersecurity,Tel Aviv,Israel,Asia,2014,583000000,"General Atlantic, Insight Partners, Vintage Investment Partners",2021
LaunchDarkly,3000000000,Internet software & services,Oakland,United States,North America,2014,330000000,"Uncork Capital, Threshold Ventures, Bloomberg Beta",2021
PolicyBazaar,2000000000,Fintech,Gurgaon,India,Asia,2008,634000000,"Info Edge, Softbank Capital",2019
Afiniti,2000000000,Artificial intelligence,Hamilton,Bermuda,North America,2006,120000000,GAM Holding,2017
ASAPP,2000000000,Artificial intelligence,New York,United States,North America,2014,380000000,"March Capital Partners, HOF Capital, Emergence Capital Partners",2021
Public,1000000000,Fintech,New York,United States,North America,2008,309000000,"Accel, Greycroft, Advancit Capital",2021
SmartMore,1000000000,Artificial Intelligence,Shenzhen,China,Asia,2019,300000000,"IDG Capital, ZhenFund, Sequoia Capital China",2021
Sunbit,1000000000,Fintech,Los Angeles,United States,North America,2016,210000000,"Zeev Ventures, Group11, Chicago Ventures",2021
TangoMe,1000000000,Mobile & telecommunications,Mountain View,United States,North America,2009,361000000,"Draper Fisher Jurtson, Qualcomm Ventures, Alibaba Group",2014
Bringg,1000000000,"Supply chain, logistics, & delivery",Tel Aviv,Israel,Asia,2013,185000000,"Salesforce Ventures, next47, Pereg Ventures",2021
C2FO,1000000000,Fintech,Leawood,United States,North America,2008,538000000,"Union Square Ventures, Summerhill Venture Partners, Mithril Capital Management",2019
Heyday,1000000000,E-commerce & direct-to-consumer,Chicago,United States,North America,2017,800000000,"Khosla Ventures,General Catalyst, Victory Park Capital",2021
NoBroker,1000000000,Internet software & services,Bengaluru,India,Asia,2014,424000000,"General Atlantic, Elevation Capital, BEENEXT",2021
Noname Security,1000000000,Cybersecurity,Palo Alto,United States,North America,2020,220000000,"Insight Partners, Lightspeed Venture Partners, CyberStarts",2021
Snorkel AI,1000000000,Artificial intelligence,Palo Alto,United States,North America,2019,135000000,"Greylock Partners, Google Ventures, BlackRock",2021
Solo.io,1000000000,Internet software & services,Cambridge,United States,North America,2017,172000000,"True Ventures, Altimeter Capital, Redpoint Ventures",2021
SoundHound,1000000000,Artificial intelligence,Santa Clara,United States,North America,2005,215000000,"Tencent Holdings, Walden Venture Capital, Global Catalyst Partnera",2018
Splashtop,1000000000,Internet software & services,San Jose,United States,North America,2006,114000000,"Storm Ventures, DFJ DragonFund, New Enterprise Associates",2021
Bytedance,180000000000,Artificial intelligence,Beijing,China,Asia,2012,8000000000,"Sequoia Capital China, SIG Asia Investments, Sina Weibo, Softbank Group",2017
SpaceX,100000000000,Other,Hawthorne,United States,North America,2002,7000000000,"Founders Fund, Draper Fisher Jurvetson, Rothenberg Ventures",2012
SHEIN,100000000000,E-commerce & direct-to-consumer,Shenzhen,China,Asia,2008,2000000000,"Tiger Global Management, Sequoia Capital China, Shunwei Capital Partners",2018
Stripe,95000000000,Fintech,San Francisco,United States,North America,2010,2000000000,"Khosla Ventures, LowercaseCapital, capitalG",2014
Klarna,46000000000,Fintech,Stockholm,Sweden,Europe,2005,4000000000,"Institutional Venture Partners, Sequoia Capital, General Atlantic",2011
Canva,40000000000,Internet software & services,Surry Hills,Australia,Oceania,2012,572000000,"Sequoia Capital China, Blackbird Ventures, Matrix Partners",2018
Checkout.com,40000000000,Fintech,London,United Kingdom,Europe,2012,2000000000,"Tiger Global Management, Insight Partners, DST Global",2019
Instacart,39000000000,"Supply chain, logistics, & delivery",San Francisco,United States,North America,2012,3000000000,"Khosla Ventures, Kleiner Perkins Caufield & Byers, Collaborative Fund",2014
Databricks,38000000000,Data management & analytics,San Francisco,United States,North America,2013,3000000000,"Andreessen Horowitz, New Enterprise Associates, Battery Ventures",2019
Revolut,33000000000,Fintech,London,United Kingdom,Europe,2015,2000000000,"index Ventures, DST Global, Ribbit Capital",2018
Epic Games,32000000000,Other,Cary,United States,North America,1991,7000000000,"Tencent Holdings, KKR, Smash Ventures",2018
Fanatics,27000000000,E-commerce & direct-to-consumer,Jacksonville,United States,North America,2002,4000000000,"SoftBank Group, Andreessen Horowitz, Temasek Holdings",2012
Chime,25000000000,Fintech,San Francisco,United States,North America,2013,2000000000,"Forerunner Ventures, Crosslink Capital, Homebrew",2019
BYJU's,22000000000,Edtech,Bengaluru,India,Asia,2008,4000000000,"Tencent Holdings, Lightspeed India Partners, Sequoia Capital India",2017
J&T Express,20000000000,"Supply chain, logistics, & delivery",Jakarta,Indonesia,Asia,2015,5000000000,"Hillhouse Capital Management, Boyu Capital, Sequoia Capital China",2021
Xiaohongshu,20000000000,E-commerce & direct-to-consumer,Shanghai,China,Asia,2013,918000000,"GGV Capital, ZhenFund, Tencent",2016
Miro,18000000000,Internet software & services,San Francisco,United States,North America,2011,476000000,"Accel, AltaIR Capital, Technology Crossover Ventures",2022
Rapyd,15000000000,Fintech,London,United Kingdom,Europe,2016,770000000,"Target Global, General Catalyst, Durable Capital Partners",2019
Discord,15000000000,Internet software & services,San Francisco,United States,North America,2012,979000000,"Benchmark, Greylock Partners, Tencent Holdings",2018
Genki Forest,15000000000,Consumer & retail,Beijing,China,Asia,2016,721000000,"Sequoia Capital China, Longfor Capitalm, Gaorong Capital",2020
goPuff,15000000000,E-commerce & direct-to-consumer,Philadelphia,United States,North America,2013,3000000000,"Accel, Softbank Group, Anthos Capital",2020
Blockchain.com,14000000000,Fintech,London,United Kingdom,Europe,2011,490000000,"Lightspeed Venture Partners, Google Ventures, Lakestar",2021
Plaid,13000000000,Fintech,San Francisco,United States,North America,2012,734000000,"New Enterprise Associates, Spar Capital, Index Ventures",2018
Devoted Health,13000000000,Health,Waltham,United States,North America,2017,2000000000,"Andreessen Horowitz, F-Prime Capital, Venrock",2018
OpenSea,13000000000,E-commerce & direct-to-consumer,New York,United States,North America,2017,427000000,"Andreessen Horowitz, Thirty Five Ventures, Sound Ventures",2021
Grammarly,13000000000,Internet software & services,San Francisco,United States,North America,2009,400000000,"General Catalyst, Institutional Venture Partners, Breyer Capital",2019
Argo AI,12000000000,Artificial intelligence,Pittsburgh,United States,North America,2016,4000000000,"Volkswagen Group, Ford Autonomous Vehicles",2019
Northvolt,12000000000,Other,Stockholm,Sweden,Europe,2016,4000000000,"Vattenfall, Volkswagen Group, Goldman Sachs",2019
Faire,12000000000,Artificial intelligence,San Francisco,United States,North America,2017,1000000000,"Khosla Ventures, Forerunner Ventures, Sequoia Capital",2019
Cider,1000000000,E-commerce & direct-to-consumer,Central,Hong Kong,Asia,2020,140000000,"Andreessen Horowitz, DST Global, IDG Capital",2021
WeLab,1000000000,Fintech,Central,Hong Kong,Asia,2013,871000000,"Sequoia Capital China, ING, Alibaba Entrepreneurs Fund",2017
Trax,3000000000,Artificial intelligence,,Singapore,Asia,2010,1000000000,"Hopu Investment Management, Boyu Capital, DC Thomson Ventures",2019
Ninja Van,2000000000,"Supply chain, logistics, & delivery",,Singapore,Asia,2014,975000000,"B Capital Group, Monk's Hill Ventures, Dynamic Parcel Distribution",2021
Advance Intelligence Group,2000000000,Artificial intelligence,,Singapore,Asia,2016,536000000,"Vision Plus Capital, GSR Ventures, ZhenFund",2021
Carousell,1000000000,E-commerce & direct-to-consumer,,Singapore,Asia,2012,288000000,"500 Global, Rakuten Ventures, Golden Gate Ventures",2021
Matrixport,1000000000,Fintech,,Singapore,Asia,2019,100000000,"Dragonfly Captial, Qiming Venture Partners, DST Global",2021
Airtable,12000000000,Internet software & services,San Francisco,United States,North America,2013,1000000000,"Caffeinated Capital, CRV, Founder Collective",2018
Brex,12000000000,Fintech,San Francisco,United States,North America,2017,1000000000,"DST Global, Ribbit Capital, Greenoaks Capital Management",2018
Getir,12000000000,E-commerce & direct-to-consumer,Istanbul,Turkey,Europe,2015,2000000000,"Tiger Global Management, Sequoia Capital, Revo Capital",2021
Biosplice Therapeutics,12000000000,Health,San Diego,United States,North America,2008,799000000,"Vickers Venture Partners, IKEA GreenTech",2018
Bitmain,12000000000,Hardware,Beijing,China,Asia,2015,765000000,"Coatue Management, Sequoia Capital China, IDG Capital",2018
GoodLeap,12000000000,Internet software & services,Roseville,United States,North America,2003,800000000,"New Enterprise Associates, BDT Capital Partners, Davidson Kempner Capital Management",2021
Xingsheng Selected,12000000000,E-commerce & direct-to-consumer,Changsha,China,Asia,2009,5000000000,"KKR, Tencent Holdings, Sequoia Capital China",2020
ZongMu Technology,11000000000,Auto & transportation,Shanghai,China,Asia,2013,376000000,"LTW Capital, Legend Capital, Qualcomm Ventures",2021
Bolt,11000000000,Auto & transportation,Tallinn,Estonia,Europe,2013,1000000000,"Didi Chuxing, Diamler, TMT Investments",2018
Swiggy,11000000000,"Supply chain, logistics, & delivery",Bengaluru,India,Asia,2014,5000000000,"Accel India, SAIF Partners, Norwest Venture Partners",2018
Weilong Foods,11000000000,Consumer & retail,Luohe,China,Asia,1999,558000000,"Tencent Holdings, Hillhouse Capital Management, Yunfeng Capital",2021
Global Switch,11000000000,Hardware,London,United Kingdom,Europe,1998,5000000000,"Aviation Industry Corporation of China, Essence Financial, Jiangsu Sha Steel Group",2016
Bolt,11000000000,Fintech,San Francisco,United States,North America,2014,1000000000,"Activant Capital, Tribe Capital, General Atlantic",2021
Zuoyebang,10000000000,Edtech,Beijing,China,Asia,2014,3000000000,"Sequoia Capital China, Xiang He Capital, GGV Capital",2018
Ripple,10000000000,Fintech,San Francisco,United States,North America,2012,294000000,"IDG Capital, Venture51, Lightspeed Venture Partners",2019
OYO Rooms,10000000000,Travel,Gurugram,India,Asia,2012,3000000000,"SoftBank Group, Sequoia Capital India,Lightspeed India Partners",2018
FTX,32000000000,Fintech,,Bahamas,North America,2018,2000000000,"Sequoia Capital, Thoma Bravo, Softbank",2021
OutSystems,10000000000,Internet software & services,Boston,United States,North America,2001,572000000,"KKR, ES Ventures, North Bridge Growth Equity",2018
ServiceTitan,10000000000,Internet software & services,Glendale,United States,North America,2012,1000000000,"Bessemer Venture Partners, ICONIQ Capital, Battery Ventures",2018
Alchemy,10000000000,Fintech,San Francisco,United States,North America,2017,564000000,"DFJ Growth Fund, Coatue Management, Addition",2021
Chehaoduo,10000000000,E-commerce & direct-to-consumer,Beijing,China,Asia,2015,4000000000,"Sequoia Capital China, GX Capital",2016
Digital Currency Group,10000000000,Fintech,New York,United States,North America,2015,1000000000,"Ribbit Capital, capitalG, Softbank Group",2021
Figma,10000000000,Internet software & services,San Francisco,United States,North America,2012,333000000,"Index Ventures, Greylock Partners, Kleiner Perkins Caufield & Byers",2020
Gusto,10000000000,Fintech,San Francisco,United States,North America,2011,691000000,"General Catalyst Partners, Google Ventures, Kleiner Perkins Caufield & Byers",2015
Lalamove,10000000000,"Supply chain, logistics, & delivery",Cheung Sha Wan,Hong Kong,Asia,2013,2000000000,"MindWorks Ventures, Shunwei Capital Partners, Xiang He Capital",2019
Notion Labs,10000000000,Internet software & services,San Francisco,United States,North America,2016,343000000,"Index Ventures, Draft Ventures, Felicis Ventures",2020
reddit,10000000000,Internet software & services,San Francisco,United States,North America,2005,1000000000,"Y Combinator, Sequoia Capital, Coatue Management",2017
Talkdesk,10000000000,Internet software & services,San Francisco,United States,North America,2011,497000000,"DJF, Salesforce Ventures, Storm Ventures",2018
Thrasio,10000000000,Other,Walpole,United States,North America,2018,2000000000,"Upper90, RiverPark Ventures, Advent International",2020
Dunamu,9000000000,Fintech,Seoul,South Korea,Asia,2012,71000000,"Qualcomm Ventures, Woori Investment, Hanwha Investment & Securities",2021
Yanolja,9000000000,Travel,Seoul,South Korea,Asia,2005,2000000000,"SBI Investment Korea, Partners Investment, GIC",2019
Pony.ai,9000000000,Artificial intelligence,Fremont,United States,North America,2016,1000000000,"Sequoia Capital China, IDG Capital, DCM Ventures",2018
Nuro,9000000000,Auto & transportation,Mountain View,United States,North America,2016,2000000000,"SoftBank Group, Greylock Partners, Gaorong Capital",2019
Snyk,9000000000,Cybersecurity,Boston,United States,North America,2015,1000000000,"BOLDstart Ventures, Google Ventures, Accel",2020
Kavak,9000000000,E-commerce & direct-to-consumer,Lerma de Villada,Mexico,North America,2016,2000000000,"DST Global, SoftBank Group, Mountain Nazca",2020
N26,9000000000,Fintech,Berlin,Germany,Europe,2013,2000000000,"Redalpine Venture Partners, Earlybird Venture Capital, Valar Ventures",2019
Klaviyo,9000000000,Internet software & services,Boston,United States,North America,2012,679000000,"Summit Partners, Accel, Astral Capital",2020
Niantic,9000000000,Mobile & telecommunications,San Francisco,United States,North America,2015,770000000,"Nintendo, Google, Pokemon Company International, Spark Capital",2017
Tanium,9000000000,Cybersecurity,Kirkland,United States,North America,2007,775000000,"Andreessen Horowitz, Nor-Cal Invest, TPG Growth",2015
Dream11,8000000000,Internet software & services,Mumbai,India,Asia,2007,2000000000,"Kaalari Capital, Tencent Holdings, Steadview Capital",2019
Netskope,8000000000,Cybersecurity,Santa Clara,United States,North America,2012,1000000000,"Lightspeed Venture Partners, Social Capital, Accel",2018
Razorpay,8000000000,Fintech,Bengaluru,India,Asia,2013,742000000,"Sequoia Capital India, Tiger Global Management, Matrix Partners India",2020
Dapper Labs,8000000000,Fintech,Vancouver,Canada,North America,2018,607000000,"Union Square Ventures, Venrock, Andreessen Horowitz",2021
Lacework,8000000000,Cybersecurity,San Jose,United States,North America,2015,2000000000,"Sutter Hill Ventures, Liberty Global Ventures, Coatue Management",2021
Tipalti,8000000000,Fintech,San Mateo,United States,North America,2010,549000000,"01 Advisors, Zeev Ventures, Group 11",2020
Hopin,8000000000,Internet software & services,London,United Kingdom,Europe,2019,1000000000,"Accel, Northzone Ventures, Institutional Venture Partners",2020
Caris Life Sciences,8000000000,Health,Irving,United States,North America,1996,1000000000,"Sixth Street Partners, OrbiMed Advisors, Highland Capital Management",2021
Ramp,8000000000,Fintech,New York,United States,North America,2019,660000000,"D1 Capital Partners, Stripe, Coatue Management",2021
Tempus,8000000000,Health,Chicago,United States,North America,2015,820000000,"New Enterprise Associates, T. Rowe Associates, Lightbank",2018
Fireblocks,8000000000,Fintech,New York,United States,North America,2018,1000000000,"Tenaya Capital, Coatue Management, Stripes Group",2021
Flexport,8000000000,"Supply chain, logistics, & delivery",San Francisco,United States,North America,2013,2000000000,"Bloomberg Beta, Founders Fund, First Round Capital",2018
National Stock Exchange of India,7000000000,Fintech,Mumbai,India,Asia,1998,297000000,"TA Associates, SoftBank Group, GS Growth",2020
Meicai,7000000000,Mobile & telecommunications,Beijing,China,Asia,2014,1000000000,"Tiger Global Management, Blue Lake Capital, ZhenFund",2016
Impossible Foods,7000000000,Consumer & retail,Redwood City,United States,North America,2011,2000000000,"Khosla Ventures, Horizons Ventures, Temasek Holdings",2019
CRED,7000000000,Fintech,Bengaluru,India,Asia,2018,922000000,"Tiger Global Management, DST Global, Sequoia Capital India",2021
Circle,3000000000,Fintech,Boston,United States,North America,2013,711000000,"General Catalyst, Digital Currency Group, Accel",2018
Attentive,7000000000,Mobile & telecommunications,Hoboken,United States,North America,2016,863000000,"NextView Ventures, Eniac Ventures, Sequoia Capital",2020
Ola Cabs,7000000000,Auto & transportation,Bengaluru,India,Asia,2010,4000000000,"Accel Partners, SoftBank Group, Sequoia Capital",2014
Rippling,7000000000,Internet software & services,San Francisco,United States,North America,2017,447000000,"Initialized Capital, Y Combinator, Kleiner Perkins Caufield & Byers",2020
Carta,7000000000,Fintech,San Francisco,United States,North America,2012,1000000000,"Menlo Ventures, Spark Capital, Union Square Ventures",2019
Toss,7000000000,Fintech,Seoul,South Korea,Asia,2013,844000000,"Bessemer Venture Partners, Qualcomm Ventures, Kleiner Perkins Caufield & Byers",2018
Ziroom,7000000000,E-commerce & direct-to-consumer,Beijing,China,Asia,2011,2000000000,"Sequoia Capital China, Warburg Pincus, General Catalyst",2018
Scale AI,7000000000,Artificial intelligence,San Francisco,United States,North America,2018,603000000,"Accel, Y Combinator, Index Ventures",2019
Gong,7000000000,Artificial intelligence,Palo Alto,United States,North America,2015,583000000,"Norwest Venture Partners, Next World Capital, Wing Venture Capital",2020
TripActions,7000000000,Travel,Palo Alto,United States,North America,2015,912000000,"Andreessen Horowitz, Lightspeed Venture Partners, Zeev Ventures",2018
1Password,7000000000,Cybersecurity,Toronto,Canada,North America,2005,920000000,"Slack Fund, Accel, Skip Capital",2021
Automation Anywhere,7000000000,Artificial intelligence,San Jose,United States,North America,2003,849000000,"General Atlantic, Goldman Sachs, New Enterprise Associates",2018
Gemini,7000000000,Fintech,New York,United States,North America,2015,424000000,"Morgan Creek Digital, Marcy Venture Partners, 10T Fund",2021
ConsenSys,7000000000,Fintech,New York,United States,North America,2014,660000000,"Third Point, Electric Capital, Coinbase Ventures",2021
Ro,7000000000,Health,New York,United States,North America,2017,1000000000,"Initialized Capital, General Catalyst, SignalFire",2020
Black Unicorn Factory,6000000000,Other,Los Angeles,United States,North America,2020,645000000,Barter Ventures,2021
Easyhome,6000000000,Consumer & retail,Beijing,China,Asia,1999,2000000000,"Alibaba Group, Boyu Capital, Borui Capital",2018
SVOLT,6000000000,Auto & transportation,Changzhou,China,Asia,2018,3000000000,"IDG Capital, Bank Of China Group Investment,, SDIC CMC Investment Management",2020
Airwallex,6000000000,Fintech,Melbourne,Australia,Oceania,2015,802000000,"DST Global, Sequoia Capital China, Tencent Holdings",2019
Deel,6000000000,Fintech,San Francisco,United States,North America,2018,629000000,"Andreessen Horowitz, Spark Capital, Y Combinator",2021
Mambu,6000000000,Fintech,Amsterdam,Netherlands,Europe,2011,448000000,"Runa Capital, Acton Capital Partners, Point Nine Capital",2021
Mollie,6000000000,Fintech,Amsterdam,Netherlands,Europe,2004,928000000,Technology Crossover Ventures,2020
FiveTran,6000000000,Data management & analytics,Oakland,United States,North America,2012,728000000,"Matrix Partners, Andreessen Horowitz, General Catalyst",2020
Postman,6000000000,Internet software & services,San Francisco,United States,North America,2014,433000000,"Nexus Venture Partners, CRV, Insight Partners",2020
Back Market,6000000000,E-commerce & direct-to-consumer,Paris,France,Europe,2014,1000000000,"Aglae Ventures, Eurazeo, Daphni",2021
Cityblock Health,6000000000,Health,Brooklyn,United States,North America,2017,891000000,"Thrive Capital, Maverick Ventures, Redpoint Ventures",2020
DataRobot,6000000000,Artificial intelligence,Boston,United States,North America,2012,1000000000,"New Enterprise Associates, Accomplice, IA Ventures",2019
Personio,6000000000,Internet software & services,Munich,Germany,Europe,2015,524000000,"Global Founders Capital, Nortzone Ventures, Picus Capital",2021
RELEX Solutions,6000000000,"Supply chain, logistics, & delivery",Helsinki,Finland,Europe,2005,803000000,"Blackstone, Technology Crossover Ventures, Summit Partners",2022
Vice Media,6000000000,Internet software & services,Brooklyn,United States,North America,1994,1000000000,"Technology Crossover Ventures, A&E Television Networks",2011
Workato,6000000000,Internet software & services,Mountain View,United States,North America,2013,415000000,"Battery Ventures, Storm Ventures, Redpoint Ventures",2021
Upgrade,6000000000,Fintech,San Francisco,United States,North America,2016,587000000,"Union Square Ventures, Ribbit Capital, VY Capital",2018
Lianjia,6000000000,E-commerce & direct-to-consumer,Beijing,China,Asia,2001,1000000000,"Tencent, Baidu, Huasheng Capital",2016
Hinge Health,6000000000,Health,San Francisco,United States,North America,2015,826000000,"Atomico, Insight Partners, Coatue Management",2021
Lyra Health,6000000000,Health,Burlingame,United States,North America,2015,910000000,"Greylock Partners, Venrock, Providence Ventures",2020
Benchling,6000000000,Internet software & services,San Francisco,United States,North America,2012,412000000,"Thrive Capital, Benchmark, MenloVentures",2021
Better.com,6000000000,Fintech,New York,United States,North America,2018,405000000,"Pine Brook, American Express Ventures, Kleiner Perkins Caufield & Byers",2020
iCapital Network,6000000000,Fintech,New York,United States,North America,2013,729000000,"BlackRock, Blackstone, UBS",2021
Wiz,6000000000,Cybersecurity,Tel Aviv,Israel,Asia,2020,600000000,"Insight Partners, Sequoia Capital, Index Ventures",2021
DailyHunt,5000000000,Internet software & services,Bengaluru,India,Asia,2007,869000000,"Falcon Edge Capital, Omidyar Network, Sequoia Capital India",2020
Howden Group Holdings,5000000000,Other,London,United Kingdom,Europe,1994,187000000,"General Atlantic, 3i Group, Huagai Capital",2020
Meesho,5000000000,Internet software & services,Bengaluru,India,Asia,2015,1000000000,"Venture Highway, Sequoia Capital India, Prosus Ventures",2021
Playco,1000000000,Other,Tokyo,Japan,Asia,2020,140000000,"Sozo Ventures, Caffeinated Capital, Sequoia Capital",2020
Meizu Technology,5000000000,Hardware,Zhuhai,China,Asia,2003,943000000,"Telling Telecommunication Holding Co., Alibaba Group",2014
CloudWalk Technology,5000000000,Artificial intelligence,Guangzhou,China,Asia,2015,514000000,"Oriza Holdings, Guangdong Technology Financial Group",2018
Royole Corporation,5000000000,Hardware,Shenzhen,China,Asia,2012,492000000,"Warmsun Holding, IDG Capital Partners",2015
Monzo,5000000000,Fintech,London,United Kingdom,Europe,2015,1000000000,"Passion Capital, Thrive Capital, Orange Digital Ventures",2018
Socure,5000000000,Cybersecurity,New York,United States,North America,2012,644000000,"Two Sigma Ventures, Flint Capital, Commerce Ventures",2021
VIPKid,5000000000,Edtech,Beijing,China,Asia,2013,1000000000,"Sequoia Capital China, Tencent Holdings, Sinovation Ventures",2016
Vinted,5000000000,E-commerce & direct-to-consumer,Vilnius,Lithuania,Europe,2008,562000000,"Accel, Insight Partners, Burda Principal Investments",2019
Lendable,5000000000,Fintech,London,United Kingdom,Europe,2014,286000000,"Ontario Teachers' Pension Plan, Goldman Sachs",2021
UBTECH Robotics,5000000000,Hardware,Shenzhen,China,Asia,2012,943000000,"CDH Investments, Goldstone Investments, Qiming Venture Partners",2016
Anduril,5000000000,Artificial intelligence,Irvine,United States,North America,2017,691000000,"Andreessen Horowitz, Founders Fund, Revolution Ventures",2019
Checkr,5000000000,Internet software & services,San Francisco,United States,North America,2014,559000000,"Y Combinator, Accel, T. Rowe Price",2019
Color,5000000000,Health,Burlingame,United States,North America,2013,497000000,"General Catalyst, Viking Global Investors, T. Rowe Price",2021
Dataiku,5000000000,Internet software & services,New York,United States,North America,2013,647000000,"Alven Capital, FirstMark Capital, capitalG",2019
BetterUp,5000000000,Internet software & services,San Francisco,United States,North America,2013,567000000,"Threshold Ventures, Lightspeed Venture Partners, Crosslink Capital",2021
Pleo,5000000000,Fintech,Copenhagen,Denmark,Europe,2015,428000000,"Creandum, Founders, Kinnevik",2021
Trade Republic,5000000000,Fintech,Berlin,Germany,Europe,2015,996000000,"Founders Fund, Accel, Creandum",2021
Chipone,5000000000,Hardware,Beijing,China,Asia,2008,1000000000,"China Grand Prosperity Investment, Silk Road Huacheng, Oriza Equity Investment",2021
Collibra,5000000000,Data management & analytics,Brussels,Belgium,Europe,2008,596000000,"Index Ventures, Battery Ventures, ICONIQ Capital",2019
Rappi,5000000000,"Supply chain, logistics, & delivery",Bogota,Colombia,South America,2015,2000000000,"DST Global, Andreessen Horowitz, Sequoia Capital, Redpoint e.ventures",2018
Cerebral,5000000000,Health,San Francisco,United States,North America,2020,462000000,"Oak HC/FT Partners, Artis Ventures, WestCap Group",2021
Creditas,5000000000,Fintech,Sao Paulo,Brazil,South America,2012,824000000,"Kaszek Ventures, Amadeus Capital Partners, Quona Capital",2020
OneTrust,5000000000,Internet software & services,Atlanta,United States,North America,2016,926000000,Insight Partners,2019
