company,valuation,industry,city,country,continent,year_founded,funding,select_investors,year_joined
Forter,3000000000,Cybersecurity,New York,United States,North America,2013,525000000,"Sequoia Capital Israel, Scale Venture Partners, Commerce Ventures",2020
Grafana Labs,3000000000,Internet software & services,New York,United States,North America,2014,535000000,"Lightspeed Venture Partners, Lead Edge Capital, Coatue Management",2021
Groww,3000000000,Fintech,Bengaluru,India,Asia,2017,393000000,"Tiger Global Management, Sequoia Capital India, Ribbit Capital",2021
Inxeption,3000000000,Fintech,San Francisco,United States,North America,2017,187000000,"Coatue Management, BMO Capital, Schonfeld Strategic Advisors",2022
KK Group,3000000000,E-commerce & direct-to-consumer,Dongguan,China,Asia,2014,612000000,"Matrix Partners China, Bright Venture Capita, Shenzhen Capital Group",2019
Lattice,3000000000,Internet software & services,San Francisco,United States,North America,2015,329000000,"Khosla Ventures, Thrive Capital, Y Combinator",2021
Lucid,3000000000,Internet software & services,South Jordan,United States,North America,2010,170000000,"Spectrum Equity, ICONIQ Capital, Grayhawk Capital",2021
Outschool,3000000000,Edtech,San Francisco,United States,North America,2015,240000000,"Uniion Square Ventures, Tiger Global Management, Lightspeed Venture Capital",2021
Podium,3000000000,Internet software & services,Lehi,United States,North America,2014,419000000,"Accel, Summit Partners, Google Ventures",2020
Remote,3000000000,Fintech,San Francisco,United States,North America,2016,496000000,"Index Ventures, Sequoia Capital, General Catalyst",2021
MobiKwik,1000000000,Fintech,Gurugram,India,Asia,2009,249000000,"Sequoia Capital India, The Times Group, GMO VenturePartners",2021
Seismic,3000000000,Internet software & services,San Diego,United States,North America,2010,427000000,"Jackson Square Ventures, General Atlantic, Lightspeed Venture Partners",2018
Sky Mavis,3000000000,Internet software & services,Ho Chi Minh City,Vietnam,Asia,2019,311000000,"Fabric Ventures, 500 Global, Standard Crypto",2021
SouChe Holdings,3000000000,E-commerce & direct-to-consumer,Hangzhou,China,Asia,2012,1000000000,"Morningside Ventures, Warburg Pincus, CreditEase Fintech Investment Fund",2017
TradingView,3000000000,Fintech,Westerville,United States,North America,2011,339000000,"Tiger Global Management, Insight Partners, Jump Capital",2021
wefox,3000000000,Fintech,Berlin,Germany,Europe,2014,919000000,"Salesforce Ventures, Seedcamp, OMERS Ventures",2019
Wildlife Studios,3000000000,Other,Sao Paulo,Brazil,South America,2011,180000000,"Benchmark, Bessemer Venture Partners",2019
1047 Games,2000000000,Internet software & services,Zephyr Cove,United States,North America,2017,127000000,"VGames, Lakestar, Galaxy Interactive",2021
Baiwang,2000000000,Fintech,Beijing,China,Asia,2015,224000000,"Guozhong Venture Capital Management, Shenzhen Capital Group, Oriental Fortune Capital",2019
Boba,2000000000,Fintech,San Francisco,United States,North America,2018,45000000,"DeFi Technologies, Hypersphere Ventures, M13",2022
Bought By Many,2000000000,Fintech,London,United Kingdom,Europe,2012,477000000,"Octopus Ventures, Munich Re Ventures, CommerzVentures",2021
Cambridge Mobile Telematics,2000000000,Mobile & telecommunications,Cambridge,United States,North America,2010,503000000,SoftBank Group,2018
Carzone,2000000000,E-commerce & direct-to-consumer,Jiangsu,China,Asia,1995,946000000,"Alibaba Group,Co-Stone Venture Capital, Buhuo Venture Capital",2019
CFGI,2000000000,Fintech,Boston,United States,North America,2000,19000000,"The Carlyle Group, CVC Capital Partners",2021
Cgtz,2000000000,Fintech,Hangzhou,China,Asia,2014,536000000,"Shunwei Capital Partners, China Media Group, Guangzhou Huiyin Aofeng Equity Investment Fund",2017
Changingedu,2000000000,Edtech,Shanghai,China,Asia,2014,188000000,"Trustbridge Partners, IDG Capital, Sequoia Capital China",2017
eDaili,2000000000,E-commerce & direct-to-consumer,Shanghai,China,Asia,2015,101000000,"K2VC, Lightspeed China Partners, Sky9 Capital",2019
ENOVATE,2000000000,Auto & transportation,Shanghai,China,Asia,2015,1000000000,Automobile Industry Guidance Fund,2019
Fenbi Education,2000000000,Edtech,Beijing,China,Asia,2015,390000000,"Trustbridge Partners, Hony Capital, IDG Capital",2021
Hesai Tech,2000000000,Artificial intelligence,Shanghai,China,Asia,2013,717000000,"Lightspeed China Partners, Baidu Ventures, Qiming Venture Partners",2020
Il Makiage,2000000000,E-commerce & direct-to-consumer,New York,United States,North America,2018,29000000,"L Catterton, Franklin Templeton, First Light Capital Group",2022
Iluvatar CoreX,2000000000,Hardware,Shanghai,China,Asia,2015,186000000,"Centurium Capital, Cedarlake Capital, Unicom Innovation Venture Capital",2021
Jusfoun Big Data,2000000000,Data management & analytics,Beijing,China,Asia,2010,137000000,"Boxin Capital, DT Capital Partners, IDG Capital",2018
Pagaya,2000000000,Fintech,Tel Aviv,Israel,Asia,2015,417000000,"Oak HC/FT Partners, GF Investments, Harvey Golub Family Office",2020
Promasidor Holdings,2000000000,Consumer & retail,Bryanston,South Africa,Asia,1979,556000000,"IFC, Ajinomoto",2016
Tubatu.com,2000000000,E-commerce & direct-to-consumer,Shenzhen,China,Asia,2008,216000000,"Sequoia Capital China, Matrix Partners China, 58.com",2015
Ximalaya FM,2000000000,Mobile & telecommunications,Shanghai,China,Asia,2012,71000000,"China Creation Ventures, Sierra Ventures, Xingwang Investment Management",2017
HEYTEA,2000000000,Other,Shenzhen,China,Asia,2012,594000000,"Sequoia Capital China, Tencent Investment, BA Capital",2019
BGL Group,2000000000,Fintech,Peterborough,United Kingdom,Europe,1992,696000000,CPP Investment Board,2017
Claroty,2000000000,Cybersecurity,New York,United States,North America,2015,640000000,"Bessemer Venture Partners, MoreVC, Team8",2021
Improbable,2000000000,Other,London,United Kingdom,Europe,2012,754000000,"Andreessen Horowitz, SoftBank Group, Temasek Holdings",2017
InMobi,2000000000,Mobile & telecommunications,Bengaluru,India,Asia,2007,221000000,"Kleiner Perkins Caufield & Byers, Softbank Corp., Sherpalo Ventures",2014
Pantheon Systems,2000000000,Internet software & services,San Francisco,United States,North America,2010,200000000,"Foundry Group, Scale Venture Partners, SoftBank Group",2021
SellerX,2000000000,E-commerce & direct-to-consumer,Berlin,Germany,Europe,2020,766000000,"Cherry Ventures, Felix Capital, 83North",2021
AppDirect,2000000000,E-commerce & direct-to-consumer,San Francisco,United States,North America,2009,431000000,"Mithril, iNovia Capital, Foundry Group",2015
BrewDog,2000000000,Consumer & retail,Aberdeen,United Kingdom,Europe,2007,233000000,"TSG Consumer Partners, Crowdcube",2017
Enflame,2000000000,Hardware,Shanghai,China,Asia,2018,472000000,"Tencent Holdings, Delta Capital, Redpoint Ventures China",2021
Tradeshift,2000000000,Fintech,San Francisco,United States,North America,2009,861000000,"Notion Capital, Scentan Ventures, Kite Ventures",2018
HeartFlow,2000000000,Health,Redwood City,United States,North America,2007,568000000,"BlueCross BlueShield Venture Partners, US Venture Partners",2017
Extend,2000000000,Fintech,San Francisco,United States,North America,2004,320000000,"GreatPoint Ventures, Meritech Capital Partners, PayPal Ventures",2021
Airbyte,2000000000,Internet software & services,San Francisco,United States,North America,2020,181000000,"Accel, Benchmark, SV Angel",2021
Andela,2000000000,Internet software & services,New York,United States,North America,2014,381000000,"Spark Capital, Google Ventures, CRE Venture Capital",2021
Ascend Money,2000000000,Fintech,Bangkok,Thailand,Asia,2013,150000000,"Ant Group, Charoen Pokphand Group, Bow Wave Capital",2021
Athelas,2000000000,Health,Mountain View,United States,North America,2016,150000000,"Sequoia Capital, General Catalyst, Human Capital",2022
Built,2000000000,Internet software & services,Nashville,United States,North America,2015,289000000,"Nyca Partners, Index Ventures, Technology Crossover Ventures",2021
candy.com,2000000000,Fintech,New York,United States,North America,2021,100000000,"Insight Partners, Softbank Group, Connect Ventures",2021
Cognite,2000000000,Data management & analytics,Lysaker,Norway,Europe,2016,225000000,"Technology Crossover Ventures, Accel, Aker",2021
CoinList,2000000000,Fintech,San Francisco,United States,North America,2017,119000000,"Accomplice, Polychain Capital, GoldenTree Asset Management",2021
Collective Health,2000000000,Fintech,San Francisco,United States,North America,2013,719000000,"New Enterprise Associates, Founders Fund, Google Ventures",2019
Culture Amp,2000000000,Internet software & services,Richmond,Australia,Oceania,2011,257000000,"Felicis Ventures, Index Ventures, Blackbird Ventures",2021
Devo,2000000000,Data management & analytics,Cambridge,United States,North America,2011,381000000,"Insight Partners, Kibo Ventures, Bessemer Venture Partners",2021
ElasticRun,2000000000,"Supply chain, logistics, & delivery",Pune,India,Asia,2016,435000000,"Kalaari Capital, Norwest Venture Partners, Prosus Ventures",2022
Gett,2000000000,Auto & transportation,London,United Kingdom,Europe,2010,828000000,"Volkswagen, Access Industries, Vostok New Ventures",2016
ID.me,2000000000,Cybersecurity,McLean,United States,North America,2010,142000000,"Moonshots Capital, BoxGroup, Blu Venture Investors",2021
impact.com,2000000000,Internet software & services,Santa Barbara,United States,North America,2008,261000000,"Redpoint Ventures, Providence Equity Partners, Silversmith Capital Partners",2021
Ledger,2000000000,Hardware,Paris,France,Europe,2014,466000000,"Digital Currency Group, Draper Esprit, Korelya Capital",2021
Lusha,2000000000,Internet software & services,New York,United States,North America,2016,245000000,"PSG, ION Crossover Partners",2021
Matillion,2000000000,Data management & analytics,Altrincham,United Kingdom,Europe,2011,310000000,"Scale Venture Partners, Sapphire Ventures, Battery Ventures",2021
MOLOCO,2000000000,Artificial intelligence,Redwood City,United States,North America,2013,192000000,"Smilegate Investment, DSC Investments, KTB Ventures",2021
Mu Sigma,2000000000,Data management & analytics,Northbrook,United States,North America,2004,211000000,"Sequoia Capital, General Atlantic",2013
Next Silicon,2000000000,Hardware,Tel Aviv,Israel,Asia,2018,203000000,"Amiti Ventures, Playground Global, Aleph",2021
NotCo,2000000000,Artificial Intelligence,Santiago,Chile,South America,2015,370000000,"Kaszek Ventures, SOSV, Tiger Global Management",2021
Olist,2000000000,E-commerce & direct-to-consumer,Curitiba,Brazil,South America,2015,320000000,"Redpoint e.ventures, Valor Capital Group, SoftBank Latin America Fund",2021
Pacaso,2000000000,Fintech,Cincinnati,United States,North America,2020,217000000,"Global Founders Capital, Shea Ventures, Greycroft",2021
Paradox,2000000000,Internet software & services,Scottsdale,United States,North America,2016,253000000,"Brighton Park Capital, Blue Cloud Ventures, Workday Ventures",2021
Persona,2000000000,Cybersecurity,San Francisco,United States,North America,2018,218000000,"Coatue Management, Index Ventures, Founders Fund",2021
SmartRecruiters,2000000000,Internet software & services,San Francisco,United States,North America,2010,225000000,"Mayfield Fund, Insight Partners, Rembrandt Venture Partners",2021
Snapdocs,2000000000,Fintech,San Francisco,United States,North America,2012,253000000,"Sequoia Capital, Y Combinator, F-Prime Capital",2021
Solugen,2000000000,Other,Houston,United States,North America,2016,435000000,"Fifty Years Fund, Refactor Capital, Temasek",2021
Strava,2000000000,Internet software & services,San Francisco,United States,North America,2009,152000000,"Jackson Square Ventures, Madrone Capital Partners, Sequoia Capital",2020
Temporal,2000000000,Internet software & services,Bellevue,United States,North America,2019,129000000,"Amplify Partners, Addition, Madrona Venture Group",2022
TuJia,2000000000,Travel,Beijing,China,Asia,2011,755000000,"GGV Capital, QiMing Venture Partnersl",2015
Veho,2000000000,"Supply chain, logistics, & delivery",Boulder,United States,North America,2016,299000000,"General Catalyst, Origin Ventures, Fontinalis Partners",2021
Veriff,2000000000,Artificial intelligence,Tallinn,Estonia,Europe,2015,177000000,"Accel, Institutional Venture Partners, Tiger Global Management",2022
Kujiale,1000000000,Internet software & services,Hangzhou,China,Asia,2011,235000000,"GGV Capital, IDG Capital, Linear Venture",2019
Whatnot,2000000000,E-commerce & direct-to-consumer,Marina del Rey,United States,North America,2019,225000000,"Y Combinator, Andreessen Horowitz, Wonder Ventures",2021
Zenoti,2000000000,Internet software & services,Bellevue,United States,North America,2010,331000000,"Norwest Venture Partners, Accel, Tiger Global Management",2020
Zeta,2000000000,Fintech,San Francisco,United States,North America,2015,340000000,"Sodexo Ventures, SoftBank Group",2021
Loom,2000000000,Internet software & services,San Francisco,United States,North America,2016,204000000,"Kleiner Perkins Caufield & Byers, Sequoia Capital, General Catalyst",2021
Mobile Premier League,2000000000,Internet software & services,Bengaluru,India,Asia,2018,376000000,"Sequoia Capital India, RTP Global, Go-Ventures",2021
Uala,2000000000,Fintech,Buenos Aires,Argentina,South America,2017,544000000,"Soros Fund Management, Ribbit Capital, Monashees+",2021
Wenheyou,2000000000,Other,Hunan,China,Asia,2013,90000000,"Sequoia Capital China, Warburg Pincus, IDG Capital",2021
Star Charge,2000000000,Auto & transportation,Changzhou,China,Asia,2014,125000000,"Shunwei Capital Partners, China Media Group, Guangzhou Huiyin Aofeng Equity Investment Fund",2021
ABL Space Systems,2000000000,Other,El Segundo,United States,North America,2017,419000000,"T. Rowe Price, Lockheed Martin Ventures, Fidelity Investment",2021
BitSight Technologies,2000000000,Cybersecurity,Boston,United States,North America,2013,401000000,"Menlo Ventures, GGV Capital, Flybridge Capital Partners",2021
Cao Cao Mobility,2000000000,Auto & transportation,Hangzhou,China,Asia,2015,744000000,"People Electrical Appliance Group China, Zhongrong International Trust",2018
Capitolis,2000000000,Fintech,New York,United States,North America,2017,282000000,"Sequoia Capital, Index Ventures, S Capital",2022
Carbon,2000000000,Hardware,Redwood City,United States,North America,2013,682000000,"Google Ventures, Sequoia Capital, Wakefield Group",2015
Clio,2000000000,Internet software & services,Burnaby,Canada,North America,2008,386000000,"OMERS Private Equity, T. Rowe Price, Technology Crossover Ventures",2021
Cresta,2000000000,Artificial Intelligence,San Francisco,United States,North America,2017,151000000,"Andreessen Horowitz, Greylock Partners, Sequoia Capital",2022
Exabeam,2000000000,Cybersecurity,Foster City,United States,North America,2013,390000000,"Norwest Venture Partners, Aspect Ventures, Lightspeed Venture Partners",2021
Yijiupi,1000000000,Consumer & retail,Beijing,China,Asia,2014,511000000,"Source Code Capital, Meituan Dianping, Tencent Holdings",2018
ezCater,2000000000,"Supply chain, logistics, & delivery",Boston,United States,North America,2007,421000000,"Insight Venture Partners, ICONIQ Capital, Launchpad Venture Group",2019
HomeLight,2000000000,Fintech,San Francisco,United States,North America,2012,219000000,"Zeev Ventures, Menlo Ventures,Crosslink Capital",2021
HoneyBook,2000000000,Internet software & services,San Francisco,United States,North America,2013,498000000,"Norwest Venture Partners, Hillsven Capital, Aleph",2021
Mercury,2000000000,Fintech,San Francisco,United States,North America,2019,152000000,"Andreessen Horowitz, Coatue Management, Clocktower Technology Ventures",2021
Paxos,2000000000,Fintech,New York,United States,North America,2012,538000000,"Liberty City Ventures, RRE Ventures, Mithril Capital Management",2021
SafetyCulture,2000000000,Internet software & services,Sydney,Australia,Oceania,2004,222000000,"Blackbird Ventures, IndexVentures, Tiger Global Management",2021
SmartHR,2000000000,Fintech,Tokyo,Japan,Asia,2013,190000000,"BEENEXT, World Innovation Lab, Light Street Capital",2021
Tonal,2000000000,E-commerce & direct-to-consumer,San Francisco,United States,North America,2015,450000000,"Mayfield Fund, Shasta Ventures, L Catterton",2021
Truepill,2000000000,Health,Hayward,United States,North America,2016,255000000,"Initialized Capital, Sound Ventures, TI Platform Management",2021
Unite Us,2000000000,Health,New York,United States,North America,2014,195000000,"Insight Partners, Sequoia Capital, Index Ventures",2021
Verkada,2000000000,Cybersecurity,San Mateo,United States,North America,2016,139000000,"next47, First Round Capital, Sequoia Capital",2020
Wayflyer,2000000000,Fintech,Dublin,Ireland,Europe,2019,236000000,"QED Investors, DST Global, Left Lane Capital",2022
Zhubajie,2000000000,Internet software & services,Chongqing,China,Asia,2006,445000000,"Cybernaut Growth Fund, IDG Capital",2015
Transcarent,2000000000,Health,San Francisco,United States,North America,2020,298000000,"Alta Partners, General Catalyst, Jove Equity Partners",2022
Trader Interactive,2000000000,Other,Norfolk,United States,North America,2017,624000000,Carsales,2021
Glossier,2000000000,Consumer & retail,New York,United States,North America,2014,266000000,"Forerunner Ventures, Institutional Venture Partners, Thrive Capital",2019
Hibob,2000000000,Internet software & services,Tel Aviv,Israel,Asia,2015,274000000,"Bessemer Venture Partners, Eight Roads Ventures, Battery Ventures",2021
Jobandtalent,2000000000,Internet software & services,Madrid,Spain,Europe,2009,902000000,"Kibo Ventures, SoftBank Group, Atomico",2021
Optimism,2000000000,Internet software & services,San Francisco,United States,North America,2019,179000000,"Paradigm, Huobi Ventures, Andreessen Horowitz",2022
solarisBank,2000000000,Fintech,Berlin,Germany,Europe,2016,403000000,"Yabeo Capital, SBI Investment, Vulcan Capital",2021
WEMAKEPRICE,2000000000,E-commerce & direct-to-consumer,Seoul,South Korea,Asia,2009,397000000,"IMM Investment, NXC",2015
Alan,2000000000,Fintech,Paris,France,Europe,2016,364000000,"Index Ventures, Temasek, Portag3 Ventures",2021
Biren Technology,2000000000,Hardware,Shanghai,China,Asia,2019,285000000,"V FUND, IDG Capital, Green Pine Capital Partners",2020
Voodoo,2000000000,Other,Paris,France,Europe,2013,517000000,"Tencent Holdings, Goldman Sachs",2020
Carsome,2000000000,E-commerce & direct-to-consumer,Selangor,Malaysia,Asia,2015,577000000,"Gobi Partners, 500 Startups, Ondine Capital",2021
CircleCI,2000000000,Internet software & services,San Francisco,United States,North America,2011,315000000,"Threshold Ventures, Baseline Ventures, Harrison Metal",2021
DealShare,2000000000,E-commerce & direct-to-consumer,Bengaluru,India,Asia,2018,612000000,"Alpha Wave Global, Matrix Partners India, Tiger Global Management",2022
DispatchHealth,2000000000,Health,Denver,United States,North America,2013,403000000,"Alta Partners, Questa Capital, Echo Health Venturesl",2021
Dragos,2000000000,Cybersecurity,Hanover,United States,North America,2016,358000000,"DataTribe, Energy Impact Partners, AllegisCyber Capital",2021
Gousto,2000000000,"Supply chain, logistics, & delivery",London,United Kingdom,Europe,2012,311000000,"MMC Ventures, BGF Ventures, Unilever Ventures",2020
H2O.ai,2000000000,Artificial intelligence,Mountain View,United States,North America,2011,251000000,"Nexus Venture Partners, Transamerica Ventures, Crane Venture Partners",2021
Harness,2000000000,Artificial intelligence,San Francisco,United States,North America,2016,195000000,"Menlo Ventures, Alkeon Capital Management, Citi Ventures",2021
Harry's,2000000000,Consumer & retail,New York,United States,North America,2013,792000000,"Thrive Capital, Tiger Global Management, Temasek",2018
PAX,2000000000,Consumer & retail,San Francisco,United States,North America,2007,542000000,"Tao Capital Partners, Global Asset Capital, Tiger Global Management",2018
Productboard,2000000000,Internet software & services,San Francisco,United States,North America,2014,261000000,"Index Ventures, Kleiner Perkins Caufield & Byers, Bessemer Venture Partners",2022
Reltio,2000000000,Data management & analytics,Redwood City,United States,North America,2011,237000000,"Crosslink Capital, .406 Ventures, Sapphire Ventures",2021
Spotter,2000000000,Fintech,Los Angeles,United States,North America,2019,231000000,"SoftBank Group, Access Industries, Crossbeam Venture Partners",2022
Vestiaire Collective,2000000000,E-commerce & direct-to-consumer,Paris,France,Europe,2009,663000000,"Eurazeo, IDInvest Partners, Balderton Capital",2021
Wave,2000000000,Fintech,Dakar,Senegal,Africa,2018,200000000,"Stripe, Founders Fund, Partech Partners",2021
ZenBusiness,2000000000,Fintech,Austin,United States,North America,2015,275000000,"Greycroft, Lerer Hippeau, Geekdom Fund",2021
Bowery Farming,2000000000,Other,New York,United States,North America,2015,497000000,"Temasek, Google Ventures, General Catalyst",2021
Greenlight,2000000000,Fintech,Atlanta,United States,North America,2014,557000000,"Relay Ventures, TTV Capital, Canapi Ventures",2020
KeepTruckin,2000000000,"Supply chain, logistics, & delivery",San Francisco,United States,North America,2013,417000000,"Google Ventures, Index Ventures, Scale Venture Partners",2019
Odoo,2000000000,Internet software & services,Louvain-la-Neuve,Belgium,Europe,2005,229000000,"Summit Partners, Noshaq, Sofinnova Partners",2021
Bordrin Motors,1000000000,Auto & transportation,Shanghai,China,Asia,2016,362000000,"China Grand Prosperity Investment, CSC Group",2019
Skydance Media,2000000000,Other,Santa Monica,United States,North America,2010,275000000,"RedBird Capital Partners, CJ ENM, Tencent Holdings",2020
Uptake,2000000000,Artificial intelligence,Chicago,United States,North America,2014,218000000,"Revolution, New Enterprise Associates, Caterpillar",2015
MoMo,2000000000,Fintech,Ho Chi Minh City,Vietnam,Asia,2013,434000000,"Goodwater Capital, Warburg Pincus, GS Growth",2021
Algolia,2000000000,Internet software & services,San Francisco,United States,North America,2012,334000000,"Accel, Alven Capital, Storm Ventures",2021
Pattern,2000000000,Internet software & services,Lehi,United States,North America,2013,277000000,"Knox Lane, Ainge Advisory, Carlson Private Capital Partners",2021
Spinny,2000000000,E-commerce & direct-to-consumer,Gurugram,India,Asia,2015,509000000,"General Catalyst, Eleation Capital, Avenir Growth Capital",2021
Trulioo,2000000000,Cybersecurity,Vancouver,Canada,North America,2011,474000000,"Blumberg Capital, American Express Ventures, BDC Venture Capital",2021
Zume,2000000000,Consumer & retail,Mountain View,United States,North America,2015,423000000,"Softbank Group, AME Cloud Ventures, SignalFire",2018
AIWAYS,2000000000,Auto & transportation,Shanghai,China,Asia,2017,792000000,"Jiangsu Sha Steel Group, Shanghai Puyin Industry, Funa Yuanchuang Technology",2018
Bitso,2000000000,Fintech,Mexico City,Mexico,North America,2014,378000000,"Pantera Capital, QED Investors, Coinbase Ventures",2021
BloomReach,2000000000,Artificial intelligence,Mountain View,United States,North America,2009,422000000,"Bain Capital Ventures, Sixth Street Growth, Lightspeed Venture Partners",2022
Current,2000000000,Fintech,New York,United States,North America,2015,402000000,"Expa, QED Investors, Foundation Capital",2021
Dialpad,2000000000,Internet software & services,San Francisco,United States,North America,2011,400000000,"Andreessen Horowitz, Google Ventures, Section 32",2020
G7 Networks,2000000000,"Supply chain, logistics, & delivery",Beijing,China,Asia,2006,710000000,"Eastern Bell Capital 32, SDIC CMC Investment Management, Trustbridge Partners",2022
Gympass,2000000000,Internet software & services,New York,United States,North America,2012,525000000,"General Atlantic, SoftBank Group, Atomico",2019
MUSINSA,2000000000,E-commerce & direct-to-consumer,Seoul,South Korea,Asia,2001,287000000,Sequoia Capital,2019
NuCom Group,2000000000,Other,Unterfoehring,Germany,Europe,2016,550000000,General Atlantic,2018
Reify Health,2000000000,Health,Boston,United States,North America,2012,259000000,"Sierra Ventures, Battery Ventures, Asset Management Ventures",2021
Diamond Foundry,2000000000,Other,San Francisco,United States,North America,2012,351000000,"Fashion Tech Lab, Fidelity Investments, Vast Ventures",2021
FullStory,2000000000,Internet software & services,Atlanta,United States,North America,2014,172000000,"Google Ventures, Kleiner Perkins Caufield & Byers, Stripes Group",2021
Lightricks,2000000000,Artificial intelligence,Jerusalem,Israel,Asia,2013,305000000,"Viola Ventures, Insight Partners, ClalTech, Goldman Sachs",2019
Opentrons,2000000000,Hardware,New York,United States,North America,2016,240000000,"SOSV, Khosla Ventures, Lerer Hippeau",2021
ZocDoc,2000000000,Health,New York,United States,North America,2007,374000000,"Founders Fund, Khosla Ventures, Goldman Sachs",2015
Accelerant,2000000000,Other,Colchester,United Kingdom,Europe,2018,193000000,"Deer Park Road, Altamont Capital Partners, Eldridge",2022
Huaqin Telecom Technology,2000000000,Mobile & telecommunications,Shanghai,China,Asia,2005,298000000,"Zhangjiang Haocheng Venture Capital, Walden International, Intel Capital",2019
Addepar,2000000000,Fintech,Mountain View,United States,North America,2009,676000000,"8VC, D1 Capital Partners, Sway Ventures",2021
YITU Technology,2000000000,Artificial intelligence,Shanghai,China,Asia,2012,401000000,"Sequoia Capital China, Banyan Capital",2018
CloudWalk,2000000000,Fintech,Sao Paulo,Brazil,South America,2015,345000000,"Plug and Play Ventures, Valor Capital Group, DST Global",2021
Retool,2000000000,Internet software & services,San Francisco,United States,North America,2000,96000000,Sequoia Capital,2021
Volocopter,2000000000,Auto & transportation,Bruchsal,Germany,Europe,2011,599000000,"btov Partners, Geely, Intel Capital",2022
