company,valuation,industry,city,country,continent,year_founded,funding,select_investors,year_joined
Acorns,2000000000,Fintech,Irvine,United States,North America,2012,507000000,"e.ventures, Bain Capital Ventures, Greycroft",2022
Aledade,2000000000,Health,Bethesda,United States,North America,2014,295000000,"Venrock, CVF Capital Partners, ARCH Venture Partners",2021
CoinSwitch Kuber,2000000000,Fintech,Bangalore,India,Asia,2017,301000000,"Tiger Global Management, Sequoia Capital India, Ribbit Capital",2021
ConcertAI,2000000000,Artificial Intelligence,Boston,United States,North America,2018,300000000,"Sixth Street Partners, Declaration Partners, Maverick Ventures Israel",2022
Eightfold.ai,2000000000,Internet software & services,Santa Clara,United States,North America,2016,397000000,"Foundation Capital, Institutional Venture Partners, General Catalyst",2020
FirstCry,2000000000,E-commerce & direct-to-consumer,Pune,India,Asia,2010,441000000,"SoftBank Group, SAIF Partners India, Valiant Capital Partners",2020
Forto,2000000000,"Supply chain, logistics, & delivery",Berlin,Germany,Europe,2016,593000000,"Cherry Ventures, Northzone Ventures, Global Founders Capital",2021
GoCardless,2000000000,Fintech,London,United Kingdom,Europe,2011,529000000,"Accel, Passion Capital, Balderton Capital",2022
InVision,2000000000,Internet software & services,New York,United States,North America,2011,349000000,"FirstMark Capital, Tiger Global Management, ICONIQ Capital",2017
Jeeves,2000000000,Fintech,Orlando,United States,North America,2019,268000000,"Tencent Holdings, CRV, Clocktower Technology Ventures",2022
Medable,2000000000,Internet software & services,Palo Alto,United States,North America,2013,507000000,"GSR Ventures, Sapphire Ventures, Streamlined Ventures",2021
Moveworks,2000000000,Artificial intelligence,Mountain View,United States,North America,2016,305000000,"Lightspeed Venture Partners, Sapphire Ventures, Kleiner Perkins Caufield & Byers",2021
MX Technologies,2000000000,Fintech,Lehi,United States,North America,2010,450000000,"Point72 Ventures, Pelion Venture Partners, Commerce Ventures",2021
PayFit,2000000000,Fintech,London,United Kingdom,Europe,2016,496000000,"Accel, frst, Kima Ventures",2022
ReCharge,2000000000,Fintech,Los Angeles,United States,North America,2017,277000000,"ICONIQ Growth, Bain Capital Ventures, Summit Partners",2021
Roofstock,2000000000,Fintech,Oakland,United States,North America,2015,365000000,"Khosla Ventures, Bain Capital Ventures, Lightspeed Venture Partners",2022
Rokt,2000000000,Internet software & services,New York,United States,North America,2012,487000000,"Square Peg Capital, TDM Growth Partners, Tiger Global Management",2021
Starling Bank,2000000000,Fintech,London,United Kingdom,Europe,2014,791000000,"JTC Group, Qatar Investment Authority, Fidelity Investment",2021
Ankorstore,2000000000,E-commerce & direct-to-consumer,Paris,France,Europe,2019,422000000,"Global Founders Capital, Aglae Ventures, Alven Capital",2022
4Paradigm,2000000000,Artificial intelligence,Beijing,China,Asia,2015,1000000000,"Sequoia Capital China, China Construction Bank, Bank of China",2018
Aiven,2000000000,Internet software & services,Helsinki,Finland,Europe,2016,210000000,"Institutional Venture Partners, Atomico, Earlybird Venture Capital",2021
Akulaku,2000000000,E-commerce & direct-to-consumer,Jakarta,Indonesia,Asia,2014,438000000,"DCM Ventures, IDG Capital, Siam Commercial Bank",2022
Apeel Sciences,2000000000,Other,Goleta,United States,North America,2012,640000000,"Upfront Ventures, Tao Capital Partners, Andreessen Horowitz",2020
AppsFlyer,2000000000,Mobile & telecommunications,San Francisco,United States,North America,2011,293000000,"Magma Venture Partners, Pitango Venture Capital, Qumra Capital",2020
Avant,2000000000,Artificial intelligence,Chicago,United States,North America,2012,658000000,"RRE Ventures, Tiger Global, August Capital",2012
Aviatrix,2000000000,Internet software & services,Santa Clara,United States,North America,2014,341000000,"Ignition Partners, Formation 8, CRV",2021
BlaBlaCar,2000000000,Auto & transportation,Paris,France,Europe,2006,449000000,"Accel Partners, Index Ventures, Insight Venture Partners",2015
Black Sesame Technologies,2000000000,Artificial intelligence,Shanghai,China,Asia,2016,115000000,"Northern Light Venture Capital, Xiaomi, FutureX Capital",2021
Calm,2000000000,Consumer & retail,San Francisco,United States,North America,2012,218000000,"Insight Venture Partners, TPG Growth, Sound Ventures",2019
Chipper Cash,2000000000,Fintech,San Francisco,United States,North America,2017,302000000,"Deciens Capital, Bezos Expeditions, 500 Startups",2021
Clearco,2000000000,Fintech,Toronto,Canada,North America,2015,433000000,"Highland Capital Partners, Oak HC/FT Partners, Emergence Capital Partners",2021
ClickHouse,2000000000,Data management & analytics,Portola Valley,United States,North America,2021,300000000,"Lightspeed Venture Partners, Almaz Capital Partners, Altimeter Capital",2021
Clip,2000000000,Fintech,Mexico City,Mexico,North America,2012,381000000,"Alta Ventures Mexico, General Atlantic, SoftBank Group",2021
Cloudinary,2000000000,Internet software & services,Santa Clara,United States,North America,2011,100000000,"Blackstone, Bessemer Venture Partners",2022
Deliverr,2000000000,"Supply chain, logistics, & delivery",San Francisco,United States,North America,2017,456000000,"8VC, Activant Capital, GLP Capital Partners",2021
Divvy Homes,2000000000,Fintech,San Francisco,United States,North America,2017,370000000,"Andreessen Horowitz, Caffeinated Capital, SciFi VC",2021
Dremio,2000000000,Data management & analytics,Santa Clara,United States,North America,2015,410000000,"Lightspeed Venture Partners, Redpoint Ventures, Norwest Venture Partners",2021
Druva,2000000000,Data management & analytics,Sunnyvale,United States,North America,2007,475000000,"Nexus Venture Partners, Tenaya Capital, Sequoia Capital",2019
Everlaw,2000000000,Internet software & services,Oakland,United States,North America,2010,299000000,"K9 Ventures, Menlo Ventures, Andreessen Horowitz",2020
Exotec,2000000000,Hardware,Croix,France,Europe,2015,450000000,"Breega Capital, Iris Capital, 360 Capital Partners",2022
Formlabs,2000000000,Hardware,Somerville,United States,North America,2011,251000000,"Pitango Venture Capital, DFJ Growth Fund, Foundry Group",2018
Guoquan Shihui,2000000000,Consumer & retail,Shanghai,China,Asia,2017,523000000,"Tiantu Capital, CMB International Capital, Vision Knight Capital",2021
Hive,2000000000,Artificial intelligence,San Francisco,United States,North America,2013,121000000,"Tomales Bay Capital, Bain & Company, General Catalyst",2021
HuiMin,2000000000,E-commerce & direct-to-consumer,Beijing,China,Asia,2013,517000000,"Zheshang Venture Capital, GP Capital, Western Capital Management",2016
Iterable,2000000000,Internet software & services,San Francisco,United States,North America,2013,342000000,"CRV, Blue Cloud Ventures, Index Ventures",2021
Yidian Zixun,1000000000,Mobile & telecommunications,Beijing,China,Asia,2021,151000000,"Phoenix New Media, Tianjin Haihe Industry Fund",2017
Kajabi,2000000000,Internet software & services,Irvine,United States,North America,2010,550000000,"Meritech Capital Partners, Tiger Global Management, Spectrum Equity",2021
Kaseya,2000000000,Cybersecurity,Miami,United States,North America,2000,545000000,"Insight Partners, TPG Alternative & Renewable Technologies, Ireland Strategic Investment Fund",2019
Keep,2000000000,Mobile & telecommunications,Beijing,China,Asia,2014,614000000,"Bertelsmann Asia Investments, GGV Capital, Morningside Venture Capital",2020
KRY,2000000000,Health,Stockholm,Sweden,Europe,2014,569000000,"Index Ventures, Creandum, Accel",2021
Loggi,2000000000,"Supply chain, logistics, & delivery",Sao Paulo,Brazil,South America,2013,507000000,"Qualcomm Ventures, SoftBank Group, Monashees+",2019
LTK,2000000000,Internet software & services,Dallas,United States,North America,2011,315000000,"SoftBank Group, Maverick Capital",2021
Lunar,2000000000,Fintech,Aarhus,Denmark,Europe,2015,448000000,"SEED Capital, Greyhound Capital, Socii Capital",2021
Mafengwo,2000000000,Travel,Beijing,China,Asia,2010,503000000,"Qiming Venture Partners, Capital Today, General Atlantic",2019
Magic Leap,2000000000,Hardware,Plantation,United States,North America,2010,3000000000,"Obvious Ventures, Qualcomm Ventures, Andreessen Horowitz",2014
Misfits Market,2000000000,E-commerce & direct-to-consumer,Pennsauken,United States,North America,2018,527000000,"Accel, D1 Capita Partners, Greenoaks Capital Management",2021
Modern Treasury,2000000000,Fintech,San Francisco,United States,North America,2018,183000000,"Benchmark, Altimeter Capital, Quiet Capital",2021
MURAL,2000000000,Internet software & services,San Francisco,United States,North America,2011,192000000,"Insight Partners, Tiger Global Management, Gradient Ventures",2021
Mynt,2000000000,Fintech,Taguig City,Philippines,Asia,2015,475000000,"Insight Partners, Warburg Pincus, Ayala Corporation",2021
Neo4j,2000000000,Data management & analytics,San Mateo,United States,North America,2007,408000000,"Eight Roads Ventures, One Peak Partners, Creandum",2021
Netlify,2000000000,Internet software & services,San Francisco,United States,North America,2014,202000000,"Andreessen Horowitz, Kleiner Perkins Caufield & Byers, EQT Ventures",2021
OCSiAl,2000000000,Other,Leudelange,Luxembourg,Europe,2012,285000000,"A&NN, Rusnano",2019
Opay,2000000000,Fintech,Lagos,Nigeria,Africa,2018,570000000,"Sequoia Capital China, Source Code Capital, Redpoint Ventures China",2021
Pipe,2000000000,Fintech,Miami,United States,North America,2019,566000000,"next47, MaC Venture Capital, FinVC",2021
Preferred Networks,2000000000,Artificial intelligence,Tokyo,Japan,Asia,2014,147000000,"Toyota Motor Corporation, Mizuho Financial Group, FANUC",2018
Quora,2000000000,Internet software & services,Mountain View,United States,North America,2009,226000000,"Y Combinator, Matrix Partners, Benchmark",2017
Redis Labs,2000000000,Data management & analytics,Mountain View,United States,North America,2011,356000000,"Viola Ventures, Dell Technologies Capital, Bain Capital Ventures",2020
SmartNews,2000000000,Mobile & telecommunications,Tokyo,Japan,Asia,2012,410000000,"Japan Post Capital, Globis Capital Partners, Atomico",2019
Spring Health,2000000000,Health,New York,United States,North America,2016,296000000,"Rethink Impact, Work-Bench, RRE Ventures",2021
StarkWare,2000000000,Cybersecurity,Netanya,Israel,Asia,2018,161000000,"Sequoia Capital, Paradigm, Pantera Capital",2021
SWORD Health,2000000000,Health,New York,United States,North America,2015,296000000,"Khosla Ventures, Green Innovations, Founders Fund",2021
Tier,2000000000,Travel,Berlin,Germany,Europe,2018,587000000,"Northzone Ventures, White Star Capital, Novator Partners",2021
Trendy Group International,2000000000,Consumer & retail,Kowloon,Hong Kong,Asia,1999,200000000,L Capital Partners,2012
Unqork,2000000000,Fintech,New York,United States,North America,2017,365000000,"Blackrock, capitalG, World Lab Innovation",2020
VerbIT,2000000000,Artificial intelligence,New York,United States,North America,2016,432000000,"ClalTech, Vertex Ventures, Oryzn Capital",2021
Virta Health,2000000000,Health,San Francisco,United States,North America,2015,373000000,"Caffeinated Capital, Obvious Ventures, Venrock",2020
Xinchao Media,2000000000,Internet software & services,Chengdu,China,Asia,2007,768000000,"JD.com, Baidu, Vision Plus Capital",2018
Xingyun Group,2000000000,E-commerce & direct-to-consumer,Shenzhen,China,Asia,2015,950000000,"Matrix Partners China, Eastern Bell Capital, Hongtai Capital Holdings",2020
XtalPi,2000000000,Artificial intelligence,Shenzhen,China,Asia,2014,786000000,"Tencent Holdings, 5Y Capital, Sequoia Capital China",2021
Zilch,2000000000,Fintech,London,United Kingdom,Europe,2018,339000000,"Gauss Ventures, Ventura Capital, dmg ventures",2021
56PINGTAI,1000000000,"Supply chain, logistics, & delivery",Shanghai,China,Asia,2013,188000000,"QF Capital, QC Capital, Unicom Innovation Venture Capital",2021
Alzheon,1000000000,Health,Framingham,United States,North America,2013,94000000,"ARCH Venture Partners, Ally Bridge Group",2020
Aprogen,1000000000,Health,Seongnam-Si,South Korea,Asia,2000,62000000,"Lindeman Asia Investment, Nichi-Iko Pharmaceutical",2019
Axtria,1000000000,Data management & analytics,Berkeley Heights,United States,North America,2009,206000000,"Helion Venture Partners, Bain Capital Tech Opportunities, Sequoia Capital India",2021
Cell C,1000000000,Mobile & telecommunications,Midrand,South Africa,Africa,2000,547000000,"Blue Label Telecoms, Net1 UEPS Technologies",2017
China Cloud,1000000000,Hardware,Wuxi,China,Asia,2010,523000000,"V Star Capital, GF Xinde Investment Management Co., Haitong Leading Capital Management",2018
CredAvenue,1000000000,Fintech,Chennai,India,Asia,2017,227000000,"Insight Partners, B Capital Group, Lightspeed Venture Partners",2022
DeepBlue Technology,1000000000,Artificial intelligence,Shanghai,China,Asia,2014,79000000,"DESUN Capital, Yunfeng Capital, Meridian Capital",2018
dMed Biopharmaceutical,1000000000,Health,Shanghai,China,Asia,2016,214000000,"Qiming Venture Partners, Vivo Capital, Sequoia Capital China",2021
Einride,1000000000,Auto & transportation,Stockholm,Sweden,Europe,2016,151000000,"Temasek, BUILD Capital Partners, Northzone Ventures",2021
EQRx,1000000000,Health,Cambridge,United States,North America,2020,700000000,"Nextech Invest, Casdin Capital, Google Ventures",2021
Everly Health,1000000000,E-commerce & direct-to-consumer,Austin,United States,North America,2015,231000000,"Highland Capital Partners, Next Coast Ventures, SoGal Ventures",2020
Fair,1000000000,Auto & transportation,Santa Monica,United States,North America,2016,2000000000,"CreditEase Fintech Investment Fund, BMW i Ventures, SoftBank Group",2018
Amount,1000000000,Fintech,Chicago,United States,North America,2019,243000000,"Invus Group, Hanaco Venture Capital, WestCap Group",2021
Flipboard,1000000000,Internet software & services,Palo Alto,United States,North America,2010,211000000,"Kleiner Perkins Caufield & Byers, Comcast Ventures, Insight Partners",2015
Globality,1000000000,Artificial intelligence,Menlo Park,United States,North America,2015,310000000,SoftBank Group,2019
Hosjoy,1000000000,E-commerce & direct-to-consumer,Nanjing,China,Asia,2009,139000000,"U.S.-China Green Fund, Founder H Fund, Richland Equities",2018
Huisuanzhang,1000000000,Fintech,Beijing,China,Asia,2015,227000000,"IDG Capital, Gaocheng Capital, Chuanrong Capital",2021
HuJiang,1000000000,Edtech,Shanghai,China,Asia,2001,223000000,"China Minsheng Investment, Baidu, Wanxin Media",2015
Hyperchain,1000000000,Fintech,Hangzhou,China,Asia,2016,249000000,"Yinhong Equity Investment Fund, E Fund, Ideal International",2021
iTutorGroup,1000000000,Edtech,Shanghai,China,Asia,1998,315000000,"QiMing Venture Partners, Temasek Holdings, Silverlink Capital",2015
JimuBox,1000000000,Fintech,Beijing,China,Asia,2013,131000000,"Matrix Partners China, Ventech China, Shunwei Capital Partners",2015
Juma Peisong,1000000000,"Supply chain, logistics, & delivery",Chengdu,China,Asia,2011,281000000,"Ding Xiang Capital, New Hope Fund, Sino-Ocean Capital",2018
Justworks,1000000000,Internet software & services,New York,United States,North America,2012,143000000,"Index Ventures, Thrive Capital, Bain Capital Ventures",2020
Keenon Robotics,1000000000,"Supply chain, logistics, & delivery",Shanghai,China,Asia,2010,229000000,"Yunqi Partners, SoftBank Group, iVision Ventures",2021
Kuaigou Dache,1000000000,"Supply chain, logistics, & delivery",Tianjin,China,Asia,2014,650000000,"Sequoia Capital China, InnoVision Capital, Qianhai Fund of Funds",2018
LinkSure Network,1000000000,Mobile & telecommunications,Shanghai,China,Asia,2013,52000000,N/A,2015
Aleo,1000000000,Cybersecurity,San Francisco,United States,North America,2019,228000000,"Slow Ventures, Andreessen Horowitz, SoftBank Group",2022
Modernizing Medicine,1000000000,Health,Boca Raton,United States,North America,2010,394000000,"Warburg Pincus, Summit Partners, Sands Capital",2017
OVH,1000000000,Other,Roubaix,France,Europe,1999,1000000000,"KKR, TowerBrook Capital Partners",2016
Phenom People,1000000000,Internet software & services,Ambler,United States,North America,2011,163000000,"Sierra Ventures, AXA Venture Partners, Sigma Prime Ventures",2021
Pipa Coding,1000000000,Edtech,Beijing,China,Asia,2017,268000000,"Source Code Capital, XVC Venture Capital, Hillhouse Capital Management",2021
Qingting FM,1000000000,Internet software & services,Shanghai,China,Asia,2011,164000000,"China Culture Industrial Investment Fund, We Capital, China Minsheng Investment Group",2021
Rad Power Bikes,1000000000,Auto & transportation,Seattle,United States,North America,2007,329000000,"Durable Capital Partners, Cercano Management, T. Rowe Price",2021
Shukun Technology,1000000000,Artificial Intelligence,Beijing,China,Asia,2017,211000000,"Marathon Venture Partners, Huagai Capital, China Creation Ventures",2021
Shulan Health,1000000000,Health,Hangzhou,China,Asia,2015,43000000,Qiming Venture Partners,2021
Snapdeal,1000000000,E-commerce & direct-to-consumer,New Delhi,India,Asia,2008,2000000000,"SoftBankGroup, Blackrock, Alibaba Group",2014
SumUp,1000000000,Fintech,London,United Kingdom,Europe,2011,1000000000,"American Express Ventures, Goldman Sachs, Bain Capital Credit",2019
TalkingData,1000000000,Mobile & telecommunications,Beijing,China,Asia,2013,310000000,"N5 Capital, CR Capital Mgmt, JD Digits",2021
TUNGEE,1000000000,Artificial Intelligence,Guangzhou,China,Asia,2016,171000000,"UNITY VENTURES, Qiming Venture Partners, GGV Capital",2021
UISEE Technology,1000000000,"Supply chain, logistics, & delivery",Beijing,China,Asia,2016,154000000,"Shenzhen Capital Group, Robert Bosch Venture Capital, SeptWolves Ventures",2021
Valgen Medtech,1000000000,Health,Hangzhou,China,Asia,2015,188000000,"Sequoia Capital China, China Life Investment Holding Company, Qiming Venture Partners",2021
Vectra Networks,1000000000,Artificial intelligence,San Jose,United States,North America,2011,352000000,"IA Ventures, Khosla Ventures, AME Cloud Ventures",2021
Venafi,1000000000,Cybersecurity,Salt Lake City,United States,North America,2000,174000000,"Pelion Venture Partners, Foundation Capital, Thoma Bravo",2020
Wacai,1000000000,Mobile & telecommunications,Hangzhou,China,Asia,2009,369000000,"Qiming Venture Partners, China Broadband Capital, CDH Investments",2018
WeBull,1000000000,Fintech,Changsha,China,Asia,2016,230000000,"Bojiang Capital, Hongdao Capital, Mobai Capital",2021
WTOIP,1000000000,Internet software & services,Guangzhou,China,Asia,2013,307000000,"Dark Horse Technology Group, Hopu Investment Management, Kefa Capital",2018
Xiaoe Tech,1000000000,Internet software & services,Shenzhen,China,Asia,2015,149000000,"GGV Capital, Hillhouse Capital Management, IDG Capital",2021
Yiguo,1000000000,"Supply chain, logistics, & delivery",Shanghai,China,Asia,2005,800000000,"Alibaba Group, KKR, Goldman Sachs",2016
Yimidida,1000000000,"Supply chain, logistics, & delivery",Shanghai,China,Asia,2015,554000000,"Source Code Capital, Global Logistic Properties, K2VC",2019
Yipin Shengxian,1000000000,E-commerce & direct-to-consumer,Hefei,China,Asia,2017,658000000,"Eastern Bell Capital, Capital Today, Longzhu Capital",2019
Ynsect,1000000000,Other,Evry,France,Europe,2011,393000000,"Astanor Ventures, Upfront Ventures, IDInvest Partners",2019
Hello TransTech,1000000000,Auto & transportation,Shanghai,China,Asia,2016,2000000000,"Ant Financial Services Group, GGV Capital",2018
Miaoshou Doctor,1000000000,E-commerce & direct-to-consumer,Beijing,China,Asia,2015,947000000,"Sequoia Capital China, Qiming Venture Partners, Tencent Holdings",2019
ECARX,1000000000,Auto & transportation,Wuhan,China,Asia,2016,394000000,"Geely, SIG Asia Investments, China State Capital Venture Capital Fund",2020
Eat Just,1000000000,Consumer & retail,San Francisco,United States,North America,2011,440000000,"Khosla Ventures, Horizons Ventures, Founders Fund",2017
Trumid,1000000000,Fintech,New York,United States,North America,2014,660000000,"T. Rowe Price, Dragoneer Investment Group, BlackRock",2020
Qualia,1000000000,Fintech,San Francisco,United States,North America,2015,160000000,"8VC, Menlo Ventures, Tiger Global Management",2020
Beisen,1000000000,Internet software & services,Beijing,China,Asia,2002,388000000,"Matrix Partners China, Sequoia Capital China, Genesis Capital",2021
Earnix,1000000000,Fintech,Giv'atayim,Israel,Asia,2001,98000000,"Jerusalem Venture Partners, Israel Growth Partners, Insight Partners",2021
Orca Security,1000000000,Cybersecurity,Portland,United States,North America,2019,632000000,"YL Ventures, Redpoint Ventures, GGV Capital",2021
Apus Group,1000000000,Mobile & telecommunications,Beijing,China,Asia,2014,116000000,"Redpoint Ventures, QiMing Venture Partners, Chengwei Capital",2015
Forte Labs,1000000000,Fintech,San Francisco,United States,North America,2018,910000000,"Iris Capital, Accel, Elaia Partners",2021
CureFit,1000000000,Health,Bengaluru,India,Asia,2016,665000000,"Chiratae Ventures, Accel, Kalaari Capital",2021
DT Dream,1000000000,Data management & analytics,Hangzhou,China,Asia,2015,267000000,"Alibaba Group, China Everbright Investment Management, Yinxinggu Capital",2017
fabric,1000000000,E-commerce & direct-to-consumer,Bellevue,United States,North America,2017,294000000,"Redpoint Ventures, Norwest Venture Partners, Sierra Ventures",2022
JOLLY Information Technology,1000000000,E-commerce & direct-to-consumer,Hangzhou,China,Asia,2008,96000000,"Legend Capital, CDH Investments, Sequoia Capital China",2018
K Health,1000000000,Health,New York,United States,North America,2016,271000000,"Max Ventures, Mangrove Capital Partners, 14W",2021
Mofang Living,1000000000,E-commerce & direct-to-consumer,Shanghai,China,Asia,2009,650000000,"Warburg Pincus, Aviation Industry Corporation of China",2016
Spendesk,1000000000,Fintech,Paris,France,Europe,2015,314000000,"Index Ventures, Eight Roads Ventures, General Atlantic",2022
TaxBit,1000000000,Fintech,Draper,United States,North America,2018,236000000,"Insight Partners, Coinbase Ventures, PayPal Ventures",2021
XiaoZhu,1000000000,Travel,Beijing,China,Asia,2012,572000000,"Morningside Ventures, Capital Today, JOY Capital",2017
YunQuNa,1000000000,"Supply chain, logistics, & delivery",Shanghai,China,Asia,2015,207000000,"Source Code Capital, Coatue Management, DCM Ventures",2021
Gymshark,1000000000,E-commerce & direct-to-consumer,Solihull,United Kingdom,Europe,2012,262000000,General Atlantic,2020
M1 Finance,1000000000,Fintech,Chicago,United States,North America,2015,323000000,"Left Lane Capital, Clocktower Technology Ventures, Jump Capital",2021
Ouyeel,1000000000,Internet software & services,Shanghai,China,Asia,2015,432000000,Taigang Venture Capital,2019
SonderMind,1000000000,Health,Denver,United States,North America,2014,183000000,"Kickstart Fund, General Catalyst, Drive Capital",2021
Astranis Space Technologies,1000000000,Mobile & telecommunications,San Francisco,United States,North America,2015,303000000,"Refactor Capital, Andreessen Horowitz, Fifty Years Fund",2021
Away,1000000000,E-commerce & direct-to-consumer,New York,United States,North America,2015,181000000,"Global Founders Capital, Comcast Ventures, Forerunner Ventures",2019
Cabify,1000000000,Auto & transportation,Madrid,Spain,Europe,2011,407000000,"Seaya Ventures, Otter Rock Capital, Rakuten",2018
Clarify Health,1000000000,Health,San Francisco,United States,North America,2015,328000000,"KKR, Aspenwood Ventures, Spark Capital",2022
Coda,1000000000,Internet software & services,Mountain View,United States,North America,2014,240000000,"Greylock Partners, General Catalyst, Khosla Ventures",2021
Deezer,1000000000,Internet software & services,Paris,France,Europe,2007,532000000,"Orange Digital Ventures, Access Industries",2018
Degreed,1000000000,Edtech,Pleasanton,United States,North America,2012,318000000,"Signal Peak Ventures, Owl Ventures, Jump Capital",2021
Deliverect,1000000000,Fintech,Ghent,Belgium,Europe,2018,237000000,"Newion Partners, SmartFin Capital, OMERS Ventures",2022
Envoy,1000000000,Internet software & services,San Francisco,United States,North America,2013,170000000,"Andreessen Horowitz, Initialized Capital, TriplePoint Capital",2022
Epidemic Sound,1000000000,Internet software & services,Stockholm,Sweden,Europe,2009,509000000,"EQT Partners, Blackstone",2021
Figment,1000000000,Internet software & services,Toronto,Canada,North America,2018,165000000,"Bonfire Ventures, Two Sigma Ventures, FJ Labs",2021
Firebolt,1000000000,Data management & analytics,Tel Aviv,Israel,Asia,2019,264000000,"TLV Partners, Zeev Ventures, Bessemer Venture Partners",2022
Five Star Business Finance,1000000000,Other,Chennai,India,Asia,1984,456000000,"Sequoia Capital India, Tiger Global Management, Tencent",2021
GupShup,1000000000,Internet software & services,San Francisco,United States,North America,2011,384000000,"Helion Venture Partners, Tiger Global management, CRV",2021
Kong,1000000000,Internet software & services,San Francisco,United States,North America,2007,169000000,"New Enterprise Associates, CRV, Index Ventures",2020
Koudai,1000000000,E-commerce & direct-to-consumer,Beijing,China,Asia,2010,368000000,"New Enterprise Associates, Tiger Global management, Tencent",2014
Panther Labs,1000000000,Cybersecurity,San Francisco,United States,North America,2018,141000000,"Innovation Endeavors, s28 Capital, Lightspeed Venture Partners",2021
Papa,1000000000,Health,Miami,United States,North America,2016,241000000,"Initialized Capital, Canaan Partners, Sound Ventures",2021
Pristyn Care,1000000000,Health,Gurugram,India,Asia,2018,177000000,"Sequoia Capital India, Hummingbird Ventures, Epiq Capital",2021
Rebel Foods,1000000000,E-commerce & direct-to-consumer,Pune,India,Asia,2011,521000000,"Sequoia Capital India, Lightbox Ventures, Coatue Management",2021
