company,valuation,industry,city,country,continent,year_founded,funding,select_investors,year_joined
Salt Security,1000000000,Cybersecurity,Palo Alto,United States,North America,2016,271000000,"Y Combinator, S Capital, Tenaya Capital",2022
Scalable Capital,1000000000,Fintech,Munich,Germany,Europe,2014,314000000,"BlackRock, Tengelmann Ventures, Holtzbrinck Ventures",2021
SparkCognition,1000000000,Artificial intelligence,Austin,United States,North America,2013,286000000,"March Capital Partners, Temasek, Doha Venture Capital",2022
Stash,1000000000,Fintech,New York,United States,North America,2015,426000000,"Goodwater Capital, Entree Capital, Valar Ventures",2021
Symphony,1000000000,Fintech,New York,United States,North America,2014,511000000,"BNP Paribas, Goldman Sachs, Google",2017
Tripledot,1000000000,Mobile & telecommunications,London,United Kingdom,Europe,2017,202000000,"Lightspeed Venture Partners, Access Industries, Eldridge",2022
VideoAmp,1000000000,Internet software & services,Los Angeles,United States,North America,2014,382000000,"Simon Equity Partners, Wavemaker Partners, Anthem Venture Partners",2021
Yotpo,1000000000,Internet software & services,New York,United States,North America,2011,436000000,"Bessemer Venture Partners, Vintage Investment Partners, Blumberg Capital",2021
Neon,1000000000,Fintech,Sao Paulo,Brazil,South America,2016,720000000,"Propel Venture Partners, Monashees+, BBVA",2022
Alloy,1000000000,Fintech,New York,United States,North America,2015,156000000,"Bessemer Venture Partners, Eniac Ventures, Canapi Ventures",2021
Epirus,1000000000,Other,Hawthorne,United States,North America,2018,287000000,"8VC, Bedrock Capital, Broom Ventures",2022
Klook,1000000000,Travel,Central,Hong Kong,Asia,2014,722000000,"Sequoia Capital China, Goldman Sachs, Matrix Partners China",2018
Yaoshibang,1000000000,Health,Guangzhou,China,Asia,2015,496000000,"Green Pine Capital Partners, Ivy Capital, DCM Ventures",2021
Signifyd,1000000000,Fintech,San Jose,United States,North America,2011,390000000,"Menlo Ventures, Resolute Ventures, IA Ventures",2021
Motorway,1000000000,E-commerce & direct-to-consumer,London,United Kingdom,Europe,2017,276000000,"Marchmont Ventures, BMW i Ventures, Index Ventures",2021
RIDI,1000000000,E-commerce & direct-to-consumer,Seoul,South Korea,Asia,2008,178000000,"Atinum Investment, Company K Partners, GIC",2022
Athletic Greens,1000000000,Health,New York,United States,North America,2010,115000000,"SC.Holdings, Not Boring Capital, Bolt Ventures",2022
GPclub,1000000000,Other,Seoul,South Korea,Asia,2003,67000000,Goldman Sachs,2018
Grove Collaborative,1000000000,E-commerce & direct-to-consumer,San Francisco,United States,North America,2016,475000000,"MHS Capital, NextView Ventures, Mayfield Fund",2019
Tongdun Technology,1000000000,Cybersecurity,Hangzhou,China,Asia,2013,252000000,"Advantech Capital, Temasek Holdings Ltd., Tiantu Capital Co.",2019
GetYourGuide,1000000000,Travel,Berlin,Germany,Europe,2009,656000000,"Spark Capital, Highland Europe, Sunstone Capital",2019
Unisound,1000000000,Artificial intelligence,Beijing,China,Asia,2012,361000000,"Qiming Venture Partners, China Internet Investment Fund, Qualcomm Ventures",2018
Betterment,1000000000,Fintech,New York,United States,North America,2010,335000000,"Bessemer Venture Partners, Menlo Ventures, Anthermis",2021
Cava Group,1000000000,Other,Washington,United States,North America,2010,738000000,"SWaN & Legend Ventures, Revolution Growth, Invus Group",2021
CoinTracker,1000000000,Fintech,San Francisco,United States,North America,2017,102000000,"Initialized Capital, General Catalyst, Kraken Ventures",2022
Domestika,1000000000,Internet software & services,Berkeley,United States,North America,2012,130000000,"Zeev Ventures, GSV Ventures",2022
Flock Freight,1000000000,"Supply chain, logistics, & delivery",Encinitas,United States,North America,2015,399000000,"SignalFire, GLP Capital Partners, Google Ventures",2021
InSightec,1000000000,Health,Tirat Carmel,Israel,Asia,1999,633000000,"York Capital Management, GE Healthcare, Koch Disruptive Technologies",2020
Island,1000000000,Internet software & services,Dallas,United States,North America,2020,215000000,"Insight Partners, Sequoia Capital, Stripes Group",2022
iTrustCapital,1000000000,Fintech,Long Beach,United States,North America,2018,128000000,"Left Lane Capital, Walden Venture Capital",2022
Konfio,1000000000,Fintech,Mexico City,Mexico,North America,2013,378000000,"Kaszek Ventures, QED Investors, International Finance Corporation",2021
LinkTree,1000000000,Internet software & services,Melbourne,Australia,Oceania,2016,166000000,"AirTree Ventures, Insight Partners, Index Ventures",2022
Loadsmart,1000000000,"Supply chain, logistics, & delivery",New York,United States,North America,2014,336000000,"Chromo Invest, Maersk Growth, BlackRock",2022
Lukka,1000000000,Fintech,New York,United States,North America,2014,201000000,"Liberty City Ventures, Soros Fund Management, Summer Capital",2022
Manner,1000000000,Other,Shanghai,China,Asia,2015,10000000,"Coatue Management, H Capital, Capital Today",2020
The Brandtech Group,1000000000,Other,New York,United States,North America,2015,610000000,Undisclosed,2019
TravelPerk,1000000000,Travel,Barcelona,Spain,Europe,2015,408000000,"LocalGlobe, Kinnevik, Felix Capital",2022
YugaByte,1000000000,Data management & analytics,Sunnyvale,United States,North America,2016,291000000,"Lightspeed Venture Partners, Dell Technologies Capital, Wipro Ventures",2021
Intercom,1000000000,Internet software & services,San Francisco,United States,North America,2011,241000000,"FirstMark Capital, Tiger Global Management",2018
OVO Energy,1000000000,Other,Bristol,United Kingdom,Europe,2009,324000000,"Mitsubishi Corporation, Mayfair Equity Partners",2019
BigID,1000000000,Cybersecurity,New York,United States,North America,2015,246000000,"BOLDstart Ventures, SAP.iO Fund, Scale Venture Partners",2020
CaptivateIQ,1000000000,Fintech,San Francisco,United States,North America,2014,165000000,"Sequoia Capital, Y Combinator, Accel",2022
Flipdish,1000000000,Internet software & services,Dublin,Ireland,Europe,2015,157000000,"Tencent Holdings, Tiger Global Management, Global Founders Capital",2022
Honor Technology,1000000000,Internet software & services,San Francisco,United States,North America,2014,325000000,"Andreessen Horowitz, Prosus Ventures, Thrive Capital",2021
Incode Technologies,1000000000,Cybersecurity,San Francisco,United States,North America,2015,257000000,"Dila Capital, Framework Ventures, 3L",2021
Kuaikan Manhua,1000000000,Internet software & services,Beijing,China,Asia,2014,594000000,"Sequoia Capital China, CMC Capital Partners, Tencent Holdings",2017
Marshmallow,1000000000,Fintech,London,United Kingdom,Europe,2017,116000000,"Passion Capital, Hedosophia, Outrun Ventures",2021
Mythical Games,1000000000,Internet software & services,Sherman Oaks,United States,North America,2018,260000000,"Javelin Venture Partners, Struck Capital, Alumni Ventures Group",2021
Route,1000000000,"Supply chain, logistics, & delivery",Lehi,United States,North America,2018,482000000,"Madrona Venture Group, Banner Ventures, FJ Labs",2022
Tackle.io,1000000000,Internet software & services,Boise,United States,North America,2016,148000000,"Andreessen Horowitz, Bessemer Venture Partners, Coatue Management",2021
Nexii,1000000000,Other,Vancouver,Canada,North America,2020,45000000,"Trane Technologies, Honeywell",2021
GalaxySpace,1000000000,Mobile & telecommunications,Beijing,China,Asia,2016,14000000,"Shunwei Capital Partners, 5Y Capital, Legend Capital",2020
Insider,1000000000,Internet software & services,Istanbul,Turkey,Europe,2012,167000000,"Wamda Capital, Endeavor, Riverwood Capital",2022
Spiber,1000000000,Other,Tsuruoka,Japan,Asia,2007,520000000,"Cool Japan Fund, JAFCO, The Carlyle Group",2021
Ada Support,1000000000,Artificial intelligence,Toronto,Canada,North America,2016,191000000,"Version One Ventures, Bessemer Venture Partners, FirstMark Capital",2021
AgentSync,1000000000,Fintech,Denver,United States,North America,2018,111000000,"Craft Ventures, Caffeinated Capital, Operator Collective",2021
Alation,1000000000,Internet software & services,Redwood City,United States,North America,2012,192000000,"Costanoa Ventures, Data Collective, Salesforce Ventures",2021
BigPanda,1000000000,Artificial intelligence,Mountain View,United States,North America,2012,317000000,"Advent International, Battery Ventures, Sequoia Capital Israel",2022
CarDekho,1000000000,E-commerce & direct-to-consumer,Jaipur,India,Asia,2008,448000000,"Sequoia Capital India, Hillhouse Capital Management, Sunley House Capital Management",2021
Copado,1000000000,Data management & analytics,Chicago,United States,North America,2013,271000000,"Insight Partners, Salesforce Ventures, Perpetual Investors",2021
DailyPay,1000000000,Fintech,New York,United States,North America,2016,189000000,"RPM Ventures, Inspiration Ventures, Carrick Capital Partners",2021
FloQast,1000000000,Fintech,Los Angeles,United States,North America,2013,230000000,"Polaris Partners, Insight Partners, Norwest Venture Partners",2021
Gem,1000000000,Internet software & services,San Francisco,United States,North America,2017,148000000,"Accel, Greylock Partners, Meritech Capital Partners",2021
GrubMarket,1000000000,E-commerce & direct-to-consumer,San Francisco,United States,North America,2013,382000000,"GGV Capital, BlackRock, ACE & Company",2021
Helium Systems,1000000000,Internet software & services,San Francisco,United States,North America,2013,365000000,"FirstMark Capital, Tiger Global Management, FTX Venture",2022
Inari,1000000000,Other,Cambridge,United States,North America,2016,337000000,"Flagship Pioneering, Alexandria Venture Investments, Investment Corporation of Dubai",2021
Jokr,1000000000,E-commerce & direct-to-consumer,New York,United States,North America,2021,430000000,"GGV Capital, Tiger Global Management, Greycroft",2021
LivSpace,1000000000,E-commerce & direct-to-consumer,Bengaluru,India,Asia,2015,427000000,"Jungle Ventures, Helion Venture Partners, INGKA Investments",2022
Merama,1000000000,E-commerce & direct-to-consumer,Mexico City,Mexico,North America,2020,345000000,"SoftBank Latin America Fund, Advent International, Balderton Capital",2021
MindTickle,1000000000,Internet software & services,San Francisco,United States,North America,2012,281000000,"Qualcomm Ventures, Accel, Canaan Partners",2021
MyGlamm,1000000000,E-commerce & direct-to-consumer,Mumbai,India,Asia,2015,310000000,"L'Occitane, Trifecta Capital, Bessemer Venture Partners",2021
Oda,1000000000,E-commerce & direct-to-consumer,Oslo,Norway,Europe,2013,337000000,"Kinnevik, Softbank Group, Prosus Ventures",2021
Offchain Labs,1000000000,Internet software & services,Princeton,United States,North America,2018,124000000,"Pantera Capital, Polychain Capital, Lightspeed Venture Partners",2021
Phantom,1000000000,Fintech,San Francisco,United States,North America,2021,118000000,"Paradigm, Andreessen Horowitz, Jump Capital",2022
Pilot.com,1000000000,Fintech,San Francisco,United States,North America,2016,161000000,"Index Ventures, Sequoia Capital, Bezos Expeditions",2021
Prime Medicine,1000000000,Health,Cambridge,United States,North America,2019,315000000,"Newpath Partners, Google Ventures, F-Prime Capital",2021
Qumulo,1000000000,Data management & analytics,Seattle,United States,North America,2012,347000000,"Madrona Venture Group, Kleiner Perkins Caufield & Byers, Highland Capital Partners",2020
Rohlik,1000000000,"Supply chain, logistics, & delivery",Prague,Czech Republic,Europe,2019,380000000,"Partech Partners, Index Ventures, Quadrille Capital",2021
SeekOut,1000000000,Internet software & services,Bellevue,United States,North America,2017,189000000,"Mayfield, Madrona Venture Group, Tiger Global Management",2022
Tealium,1000000000,Internet software & services,San Diego,United States,North America,2008,264000000,"Georgian Partners, Silver Lake, Presidio Ventures",2021
Workhuman,1000000000,Internet software & services,Dublin,Ireland,Europe,1999,9000000,ICG,2020
Xpressbees,1000000000,"Supply chain, logistics, & delivery",Pune,India,Asia,2012,573000000,"Norwest Venture Partners, Investcorp, Blackstone",2022
L&P Cosmetic,1000000000,Consumer & retail,Seoul,South Korea,Asia,2009,33000000,CDIB Capital,2016
Mininglamp Technology,1000000000,Artificial intelligence,Beijing,China,Asia,2014,787000000,"Russia-China Investment Fund, Tencent Holdings, Sequoia Capital China",2019
Luoji Siwei,1000000000,Edtech,Beijing,China,Asia,2012,144000000,"Sequoia Capital China, Qiming Venture Partners, Tencent Holdings",2017
IRL,1000000000,Internet software & services,San Francisco,United States,North America,2017,197000000,"Goodwater Capital, Floodgate, Founders Fund",2021
Modern Health,1000000000,Health,San Francisco,United States,North America,2017,167000000,"Kleiner Perkins Caufield & Byers, Afore Capital, Founders Fund",2021
Tuhu,1000000000,Auto & transportation,Shanghai,China,Asia,2011,875000000,"Qiming Venture Partners, Yaxia Automobile, Far East Horizon",2018
CloudBees,1000000000,Data management & analytics,San Jose,United States,North America,2010,236000000,"Matrix Partners, Lightspeed Venture Partners, Verizon Ventures",2021
Elemy,1000000000,Health,San Francisco,United States,North America,2019,323000000,"General Catalyst, Bling Capital, Felicis Ventures",2021
Guideline,1000000000,Fintech,San Mateo,United States,North America,2015,339000000,"Pelion Venture Partners, Foundation Capital, Thoma Bravo",2021
Happy Money,1000000000,Fintech,Tustin,United States,North America,2009,192000000,"FirstMark Capital, Anthemis, CMFG Ventures",2022
Rebellion Defense,1000000000,Artificial intelligence,Washington DC,United States,North America,2019,150000000,"Venrock, Innovation Endeavors, Insights Partners",2021
STORD,1000000000,"Supply chain, logistics, & delivery",Atlanta,United States,North America,2015,205000000,"Dynamo VC, Susa Ventures, Founders Fund",2021
At-Bay,1000000000,Fintech,Mountain View,United States,North America,2016,292000000,"Lightspeed Venture Partners, Khosla Ventures, Munich Re Ventures",2021
TELD,1000000000,Fintech,Qingdao,China,Asia,2014,396000000,"China Reform Fund, Gaopeng Capital, Jinhui Xingye",2019
Acko General Insurance,1000000000,Fintech,Bengaluru,India,Asia,2016,458000000,"Intact Ventures, Munich Re Ventures, General Atlantic",2021
apna,1000000000,Internet software & services,Bengaluru,India,Asia,2019,193000000,"Sequoia Capital India, Rocketship.vc, Lightspeed India Partners",2021
Mammoth Biosciences,1000000000,Health,Brisbane,United States,North America,2017,265000000,"NFX, Plum Alley, Mayfield",2021
Beyond Identity,1000000000,Cybersecurity,New York,United States,North America,2019,205000000,"New Enterprise Associates, Koch Disruptive Technologies, Evolution Equity Partners",2022
Chief,1000000000,Other,New York,United States,North America,2019,140000000,"General Catalyst, Inspired Capital, Flybridge Capital Partners",2022
CoinDCX,1000000000,Fintech,Maharashtra,India,Asia,2017,109000000,"Polychain Capital, Coinbase Ventures, Jump Capital",2021
Daily Harvest,1000000000,E-commerce & direct-to-consumer,New York,United States,North America,2014,120000000,"M13, Lightspeed Venture Partners, Lone Pine Capital",2021
Enpal,1000000000,Internet software & services,Berlin,Germany,Europe,2017,304000000,"HV Capital, Softbank Group, BlackRock",2021
eSentire,1000000000,Cybersecurity,Waterloo,Canada,North America,2001,186000000,"Edison Partners, Georgian Partners, VentureLink",2022
Firefly Aerospace,1000000000,Other,Cedar Park,United States,North America,2014,172000000,"XBTO Ventures, Raven One Ventures, SK Ventures",2021
Fundbox,1000000000,Fintech,San Francisco,United States,North America,2013,404000000,"Khosla Ventures, General Catalyst, Blumberg Capital",2021
G2,1000000000,Internet software & services,Chicago,United States,North America,2012,258000000,"Pritzker Group Venture Capital, Accel, Hyde Park Venture Partners",2021
Gaussian Robotics,1000000000,Hardware,Shanghai,China,Asia,2013,325000000,"BlueRun Ventures, Grand Flight Investment, Meituan Dianping",2021
GlobalBees,1000000000,E-commerce & direct-to-consumer,New Delhi,India,Asia,2021,185000000,"Chiratae Ventures, SoftBank Group, Trifecta Capital",2021
Ivalua,1000000000,Fintech,Redwood City,United States,North America,2000,134000000,"Ardian, Tiger Global Management, KKR",2019
Juanpi,1000000000,E-commerce & direct-to-consumer,Wuhan,China,Asia,2012,136000000,"Tiantu Capital, SAIF Partners China, Newsion Venture Capital",2016
Karat,1000000000,Internet software & services,Seattle,United States,North America,2014,169000000,"8VC, Norwest Venture Partners, Tiger Global Management",2021
LEAD School,1000000000,Edtech,Andheri,India,Asia,2012,166000000,"WestBridge Capital, GSV Ventures, Elevar Equity",2022
Nexthink,1000000000,Data management & analytics,Prilly,Switzerland,Europe,2004,346000000,"Auriga, Galeo Ventures, Highland Europe",2021
People.ai,1000000000,Internet software & services,San Francisco,United States,North America,2017,200000000,"GGV Capital, Lightspeed Venture Partners, ICONIQ Capital",2021
Pharmapacks,1000000000,E-commerce & direct-to-consumer,Islandia,United States,North America,2010,433000000,The Carlyle Group,2020
Rightway,1000000000,Health,New York,United States,North America,2017,130000000,"Thrive Capital, Khosla Ventures, Tiger Global Management",2021
Sennder,1000000000,"Supply chain, logistics, & delivery",Berlin,Germany,Europe,2015,340000000,"Accelm Scania Growth Capital, Lakestar",2021
Sisense,1000000000,Data management & analytics,New York,United States,North America,2004,274000000,"Opus Capital, Genesis Partners, Battery Ventures",2020
Staffbase,1000000000,Internet software & services,Chemnitz,Germany,Europe,2014,307000000,"Insight Partners, e.ventures, General Atlantic",2022
The Bank of London,1000000000,Fintech,London,United Kingdom,Europe,2018,90000000,"Mangrove Capital Partners,14W, ForgeLight",2021
Zego,1000000000,Fintech,London,United Kingdom,Europe,2016,202000000,"LocalGlobe, Balderton Capital, Target Global",2021
Nxin,1000000000,Internet software & services,Beijing,China,Asia,2015,53000000,"Beijing Juneng Hesheng Industry Investment Fund, Beijing Shuju Xinrong Fund",2018
Mamaearth,1000000000,E-commerce & direct-to-consumer,Gurgaon,India,Asia,2016,111000000,"Fireside Ventures, Sequoia Capital India, Stellaris Venture Partners",2021
Rivigo,1000000000,"Supply chain, logistics, & delivery",Gurgaon,India,Asia,2014,247000000,"SAIF Partners India, Warburg Pincus, Trifecta Capital Advisors",2019
Rubicon,1000000000,Other,Atlanta,United States,North America,2008,223000000,"Goldman Sachs, Leonardo DiCaprio, Promecap",2017
Socar,1000000000,Auto & transportation,Jeju-do,South Korea,Asia,2012,408000000,"Bain Capital, Altos Ventures, Songhyun Investment",2020
MobileCoin,1000000000,Fintech,San Francisco,United States,North America,2018,107000000,"General Catalyst, Future Ventures, AU21",2021
Density,1000000000,Hardware,San Francisco,United States,North America,2014,217000000,"Founders Fund, Upfront Ventures, 01 Advisors",2021
Instabase,1000000000,Data management & analytics,San Francisco,United States,North America,2015,132000000,"New Enterprise Associates, Greylock Partners, Andreessen Horowitz",2019
Jiuxian,1000000000,E-commerce & direct-to-consumer,Beijing,China,Asia,2009,250000000,"Sequoia Capital China, Rich Land Capital, Merrysunny Wealth",2015
Mixpanel,1000000000,Internet software & services,San Francisco,United States,North America,2009,277000000,"Bain Capital Tech Opportunities, Andreessen Horowitz, Sequoia Capital",2021
Sendbird,1000000000,Mobile & telecommunications,San Mateo,United States,North America,2013,221000000,"FundersClub, Y Combinator, Tiger Global Management",2021
OrCam Technologies,1000000000,Artificial intelligence,Jerusalem,Israel,Asia,2010,86000000,"Intel Capital, Aviv Venture Capital",2018
Leap Motor,1000000000,Auto & transportation,Hangzhou,China,Asia,2015,1000000000,"Sequoia Capital China, Gopher Asset Management, Shanghai Electric Group",2018
1KMXC,1000000000,Hardware,Hangzhou,China,Asia,2014,86000000,"Goldman Sachs Asset Management, SDP Investment, Alibaba Group",2021
58 Daojia,1000000000,Internet software & services,Beijing,China,Asia,2014,300000000,"KKR, Alibaba Group, Ping An Insurance",2015
Agile Robots,1000000000,Hardware,Munich,Germany,Europe,2018,240000000,"Hillhouse Capital Management, Sequoia Capital China, Linear Venture",2021
Aibee,1000000000,Artificial intelligence,Beijing,China,Asia,2017,273000000,"Sequoia Capital China, Lenovo Capital and Incubator, Group GSR Ventures",2021
Aircall,1000000000,Internet software & services,New York,United States,North America,2014,226000000,"Balderton Capital, Next World Capital, Draper Esprit",2021
Ajaib,1000000000,Fintech,Jakarta,Indonesia,Asia,2018,245000000,"Softbank Ventures Asia, Alpha JWC Ventures, Insignia Ventures Partners",2021
Alto Pharmacy,1000000000,Health,San Francisco,United States,North America,2015,524000000,"Jackson Square Ventures, Greenoaks Capital Management, Softbank Group",2020
Amagi,1000000000,Internet software & services,Bengaluru,India,Asia,2008,240000000,"Mayfield, Accel, Norwest Venture Partners",2022
Amperity,1000000000,Artificial intelligence,Seattle,United States,North America,2016,187000000,"Madrona Venture Group, Tiger Global Management, Madera Technology Partners",2021
Anyscale,1000000000,Artificial Intelligence,Berkeley,United States,North America,2019,160000000,"Andreessen Horowitz, Intel Capital, Foundation Capital",2021
Aptos,1000000000,Internet software & services,Palo Alto,United States,North America,2021,200000000,"Andreessen Horowitz, Coinbase Ventures, Tiger Global Management",2022
Aqua Security,1000000000,Cybersecurity,Ramat Gan,Israel,Asia,2015,265000000,"TLV Partners, Lightspeed Venture Partners, M12",2021
Assent,1000000000,"Supply chain, logistics, & delivery",Ottawa,Canada,North America,2010,534000000,"Vista Equity Partners, Warburg Pincus, First Ascent Ventures",2022
Augury,1000000000,Artificial intelligence,New York,United States,North America,2011,294000000,"Lerer Hippeau, Munich Re Ventures, Eclipse Ventures",2021
Axelar,1000000000,Internet software & services,Waterloo,Canada,North America,2020,64000000,"Lemniscap VC, North Island Ventures, Polychain Capital",2022
Axiom Space,1000000000,Other,Houston,United States,North America,2016,150000000,"C5 Capital, Hemisphere Ventures, The Venture Collective",2021
Banma Network Technologies,1000000000,Auto & transportation,Shanghai,China,Asia,2015,697000000,"Yunfeng Capital, SDIC Innovation Investment Management, Shang Qi Capital",2018
BeiBei,1000000000,E-commerce & direct-to-consumer,Hangzhou,China,Asia,2011,224000000,"Banyan Capital, New Horizon Capital, IDG Capital Partners",2015
BenevolentAI,1000000000,Artificial intelligence,London,United Kingdom,Europe,2013,292000000,Woodford Investment Management,2015
Berlin Brands Group,1000000000,E-commerce & direct-to-consumer,Berlin,Germany,Europe,2005,800000000,"Ardian, Bain Capital",2021
Betterfly,1000000000,Artificial intelligence,Santiago,Chile,South America,2018,205000000,"QED Investors, DST Global, Endeavor",2022
BitFury,1000000000,Hardware,Amsterdam,Netherlands,Europe,2011,170000000,"Georgian Co-Investment Fund, iTech Capital, Galaxy Digital",2018
BlackBuck,1000000000,"Supply chain, logistics, & delivery",Bengaluru,India,Asia,2015,352000000,"Accel, Sands Capital, International Finance Corporation",2021
Bluecore,1000000000,Artificial intelligence,New York,United States,North America,2013,238000000,"FirstMark Capital, Georgian Partners, Norwest Venture Partners",2021
BlueVoyant,1000000000,Cybersecurity,New York,United States,North America,2017,526000000,"8VC, Liberty Strategic Capital, Eden Global Partners",2022
Boom Supersonic,1000000000,Other,Englewood,United States,North America,2014,241000000,"WRVI Capital, Caffeinated Capital, Y Combinator",2020
Cadence,1000000000,Health,New York,United States,North America,2020,141000000,"Thrive Capital, General Catalyst, Coatue Management",2021
CAIS,1000000000,Fintech,New York,United States,North America,2009,406000000,"Franklin Templeton, Motive Partners, Apollo Global Management",2022
Cameo,1000000000,Internet software & services,Chicago,United States,North America,2016,165000000,"Lightspeed Venture Partners, Kleiner Perkins Caufield & Byers, Origin Ventures",2021
Capsule,1000000000,Health,New York,United States,North America,2016,570000000,"Thrive Capital, Durable Capital Partners, G Squared",2021
CargoX,1000000000,"Supply chain, logistics, & delivery",Sao Paulo,Brazil,South America,2015,390000000,"Valor Capital Group, Lightrock, Softbank Group",2021
CHEQ,1000000000,Cybersecurity,New York,United States,North America,2014,182000000,"Battery Ventures, Tiger Global Management, Hanaco Ventures",2022
Chronosphere,1000000000,Data management & analytics,New York,United States,North America,2019,254000000,"Greylock Partners, Lux Capital, General Atlantic",2021
Clara,1000000000,Fintech,Mexico City,Mexico,North America,2020,109000000,"DST Global, General Catalyst, Monashees+",2021
Clearcover,1000000000,Fintech,Chicago,United States,North America,2016,305000000,"American Family Ventures, Cox Enterprises, OMERS Ventures",2021
CommerceIQ,1000000000,Artificial Intelligence,Palo Alto,United States,North America,2012,196000000,"Trinity Ventures, Madrona Venture Group, Shasta Ventures",2022
Contrast Security,1000000000,Cybersecurity,Los Altos,United States,North America,2014,269000000,"Acero Capital, General Catalyst, M12",2021
Darwinbox,1000000000,Internet software & services,Hyderabad,India,Asia,2015,107000000,"Lightspeed India Partners, Sequoia Capital India, Endiya Partners",2022
Dental Monitoring,1000000000,Health,Paris,France,Europe,2014,232000000,"Vitruvian Partners, Merieux Equity Partners, Straumann",2021
DianRong,1000000000,E-commerce & direct-to-consumer,Shanghai,China,Asia,2012,549000000,"Standard Chartered, FinSight Ventures, Affirma Capital",2017
